일자,카테고리,순위,브랜드,상품명,가격
2026-01-26,스킨케어_주간,5,ブラン,"マジックティーツリーオイル, 20ml",2790
2026-01-26,스킨케어_주간,6,セルフュージョンC,"レーザーリジュベネーションクリーム, 50ml",3080
2026-01-26,스킨케어_주간,7,celimax,"THEビタAレチナールショットタイトニングブースター, 15ml",2500
2026-01-26,스킨케어_주간,8,エイプリルスキン,"リアルカロテンIPMPブレミッシュセラムパックパッド, 80枚",2700
2026-01-26,스킨케어_주간,9,Redence,"リアルPDRNコラーゲンアンプル, 30ml",2880
2026-01-26,스킨케어_주간,10,SKIN1004,"センテラアンプル, 55ml",2375
2026-01-26,스킨케어_주간,11,メディキューブ,"PDRNピンクペプチドアンプル, 30ml",2800
2026-01-26,스킨케어_주간,12,アヌア,"ナイアシンアミド10%ダークスポットセラム, 30ml",2800
2026-01-26,스킨케어_주간,13,パパレシピ,"リアルセンテラシカデイリークイッククーリングマスク, 30枚",1221
2026-01-26,스킨케어_주간,14,スキンアンドラブ,"グルタチオントナー, 200ml",2590
2026-01-26,스킨케어_주간,15,パパレシピ,"ブレミッシュバブル泥マスクパック, 140g",1221
2026-01-26,스킨케어_주간,16,パティオン,"ノスカナイントラブルセラム, 30ml",3000
2026-01-26,스킨케어_주간,17,トリデン,"ダイブインセラム, 80ml",2850
2026-01-26,스킨케어_주간,18,アヌア,"PDRNヒアルロン酸ハイドレイティングミスト, 100ml",2650
2026-01-26,스킨케어_주간,19,COSRX,"RXザビタミンC23セラム2世代, 20g",2546
2026-01-26,스킨케어_주간,20,アヌア,"ドクダミポアコントロールクレンジングオイル, 200ml",2300
2026-01-26,스킨케어_주간,21,ブラン,"マジックシカクリーム, 60ml",4790
2026-01-26,스킨케어_주간,22,イズエンツリー,"超低分子ヒアルロン酸トナー, 300ml",2385
2026-01-26,스킨케어_주간,23,アヌア,"3セラミドパンテノールモイスチャーバリアクリーム, 100ml",2800
2026-01-26,스킨케어_주간,24,ナンバーズイン,"5番 白玉グルタチオン100xTXA10集中トーニング美容液, 2個",4800
2026-01-26,스킨케어_주간,25,KATAN,"シカダーマヒットセラム5, 30g",3740
2026-01-26,스킨케어_주간,26,メディキューブ,"コウジ酸ビタナイアシントナー, 250ml",2300
2026-01-26,스킨케어_주간,27,メディキューブ,"ゼロ毛穴パッド 2.0, 70枚",2400
2026-01-26,스킨케어_주간,28,アイソイ,"インテンシブリフティングアンプルスティック, 15ml",1500
2026-01-26,스킨케어_주간,29,BRMUD,"リカバリーマッドパックツーフォームクレンザー, 110ml",1500
2026-01-26,스킨케어_주간,30,Kopher,"キュリペアメラクリーム, 35ml",3700
2026-01-26,스킨케어_주간,31,バイオヒールボ,"プロバイオダーム3Dリフティングクリーム, 50ml, ",3150
2026-01-26,스킨케어_주간,32,バイオヒールボ,"プロバイオダーム3Dリフティングクリーム, 50ml, 本品+レフィル",5490
2026-01-26,스킨케어_주간,33,BRMUD,"ディープメルティングポアクレンジングオイル, 200ml",2990
2026-01-26,스킨케어_주간,34,Laka,"ラッピングクリーム, 50ml",3100
2026-01-26,스킨케어_주간,35,One-day's you,ダクトパッドセット,2750
2026-01-26,스킨케어_주간,36,メディキューブ,"アゼライン酸ナイアシンアミドクリアトナー, 250ml",2300
2026-01-26,스킨케어_주간,37,Kopher,"キュリペアSOSメルダーシステム, 1.5ml, 20本",5600
2026-01-26,스킨케어_주간,38,COSRX,"RXザ6ペプチドスキンブースターセラム, 150ml",2356
2026-01-26,스킨케어_주간,39,manyo,"ガラクナイアシン3.0エッセンス, 30ml",2860
2026-01-26,스킨케어_주간,40,メディキューブ,"コウジ酸ビタピールショット, 80ml",2400
2026-01-26,스킨케어_주간,41,SKIN1004,"センテラクイックカーミングパッド, 70枚",3135
2026-01-26,스킨케어_주간,42,Lepique,"レチノールナイトクリーム, 50ml",2849
2026-01-26,스킨케어_주간,43,アテニア,"スキンクリアクレンズオイル - 無香, 175ml",1980
2026-01-26,스킨케어_주간,44,トリデン,"セルメイジングビタCアンプル, 30ml",1980
2026-01-26,스킨케어_주간,45,AESTURA,"アトバリア365クリームミスト, 120ml",2500
2026-01-26,스킨케어_주간,46,アヌア,"ライスブライトニング酵素洗顔パウダー, 40g",1950
2026-01-26,스킨케어_주간,47,トゥヴェール,"ナノエマルジョンディープ, 60ml",3610
2026-01-26,스킨케어_주간,48,punbaki,"ローズヒップモイスチャライジング インテンシブ クリーム, 50ml",3738
2026-01-26,스킨케어_주간,49,スキンアンドラブ,"レチノールリペアセラム, 30ml",2690
2026-01-26,스킨케어_주간,50,"dear,Klairs","PDRNビタペプチド毛穴リペアセラム, 35ml",2800
2026-01-26,스킨케어_주간,51,ラロッシュポゼ,"シカプラストリペアクリームB5+, 40ml",2899
2026-01-26,스킨케어_주간,52,SKIN1004,"プロバイオシカインテンシブアンプル, 50ml",2945
2026-01-26,스킨케어_주간,53,セラディックス,131パッケージセット,3600
2026-01-26,스킨케어_주간,54,Redence,"トーン&スポットコレクターアンプル, 30ml",2673
2026-01-26,스킨케어_주간,55,アイオペ,"レチノールレチジェクションセラム2%, 30ml",6018
2026-01-26,스킨케어_주간,56,アヌア,"PDRNヒアルロン酸100モイスチャライジングクリーム, 60ml",3200
2026-01-26,스킨케어_주간,57,原料工房,"アズレンスーディングコラーゲンゲルマスク, 5枚",2480
2026-01-26,스킨케어_주간,58,オーズナリー,"ビタ３セラム, 50ml",2850
2026-01-26,스킨케어_주간,59,KATAN,"シカダーマヒットセラム10, 30g",5720
2026-01-26,스킨케어_주간,60,manyo,"ピュアクレンジングオイル, 200ml",2530
2026-01-26,스킨케어_주간,61,ウェルダーマ,"ティーツリースージングハーブトックスピーリングパック, 150g, シリコンブラシ付き",2160
2026-01-26,스킨케어_주간,62,ラゴム,"ジェルトゥウォータークレンザー [朝洗顔], 220ml",2310
2026-01-26,스킨케어_주간,63,VTコスメティックス,"PDRNリードルショット 2STEP ハイドロゲルマスク, 5枚",1584
2026-01-26,스킨케어_주간,64,KISOCARE,"ハイドロエッセンスPHQ-6, 30ml",2554
2026-01-26,스킨케어_주간,65,celimax,"ノニエネルギーアンプル, 30ml",2600
2026-01-26,스킨케어_주간,66,AHC,"プロショットコラジュビネーションリフト4カプセルインフューズドアイクリームフォーフェイス, 30ml",3070
2026-01-26,스킨케어_주간,67,Lepique,"コラーゲンシートマスク, 4枚",2024
2026-01-26,스킨케어_주간,68,shaishaishai,"カフェインショットコラーゲンアイクリーム, 30g",2750
2026-01-26,스킨케어_주간,69,ナンバーズイン,"5番 白玉グルタチオンＣ美容液, 30ml",3000
2026-01-26,스킨케어_주간,70,ブラン,"マジックティーツリーオイル, 20ml, 2個",5020
2026-01-26,스킨케어_주간,71,COSRX,"フルフィットプロポリスシナジートナー, 150ml",1795
2026-01-26,스킨케어_주간,72,Derma Factory,"トラネキサム酸6%クリーム, 30ml, 2個",2460
2026-01-26,스킨케어_주간,73,スキンアンドラブ,"TXナイアシンエッセンストナー, 200ml",2590
2026-01-26,스킨케어_주간,74,ダルバ,"ホワイトトリュフファーストスプレーセラム, 100ml",2700
2026-01-26,스킨케어_주간,75,shaishaishai,"カフェインショットブレミッシュトーニングセラム, 30ml",2970
2026-01-26,스킨케어_주간,76,アレンシア,"PDRNもちクレジングバーム, 90g, 4個",4900
2026-01-26,스킨케어_주간,77,SKIN1004,"センテラライトクレンジングオイル, 200ml",2470
2026-01-26,스킨케어_주간,78,KITEN,"レチノールシカクリーム, 20g",2980
2026-01-26,스킨케어_주간,79,バイオヒールボ,"プロバイオダーム3Dリフティングアイ＆リンクルクリーム, 25ml, 2個",2750
2026-01-26,스킨케어_주간,80,ODELOI,"弱酸性毛穴収縮ニドソープ, 120g",2610
2026-01-26,스킨케어_주간,81,セラディックス,"ビタKダーククリア アイクリーム, 15ml",2300
2026-01-26,스킨케어_주간,82,センテリアン24,"エキスパートマデカクリームリニューPDRN, 50ml",2860
2026-01-26,스킨케어_주간,83,メディヒール,"ホワイトミルクブライトニングトナー, 300ml",2587
2026-01-26,스킨케어_주간,84,トゥヴェール,"レチノショット 0.1, 30g",3980
2026-01-26,스킨케어_주간,85,メディキューブ,"アゼライン酸16BBカーミングセラム, 30ml",2800
2026-01-26,스킨케어_주간,86,celimax,"デュアルバリアクリーミートナー, 150ml",1890
2026-01-26,스킨케어_주간,87,ブラン,"マジックシカクリーム, 60ml, 2個",8620
2026-01-26,스킨케어_주간,88,ダルバ,"オールデイセラムメイクアップフィクサー, 80ml",3200
2026-01-26,스킨케어_주간,89,アヌア,"桃70ナイアシンセラム, 30ml",2800
2026-01-26,스킨케어_주간,90,ブラン,"毛穴アンプル, 30ml",3880
2026-01-26,스킨케어_주간,91,メディキューブ,"エクソソームシカアンプル, 30ml",2800
2026-01-26,스킨케어_주간,92,Kopher,"キュリペアダーマアンプル, 100ml",4800
2026-01-26,스킨케어_주간,93,Lepique,"レチノールナイトクリーム, 50ml, 2個",4844
2026-01-26,스킨케어_주간,94,ダルバ,"ビタトーニングセラムトナー, 180ml",2540
2026-01-26,스킨케어_주간,95,アヌア,"ドクダミ70デイリーローション, 200ml",2800
2026-01-26,스킨케어_주간,96,パーフェクトワンフォーカス,"スムースクレンジングバーム, 75g",2821
2026-01-26,스킨케어_주간,97,celimax,"ノニエネルギーアンプル, 100ml",4500
2026-01-26,스킨케어_주간,98,ブラン,"9倍濃縮したドクダミ化粧水, 300ml, ",2980
2026-01-26,스킨케어_주간,99,アヌア,"ドクダミ80モイスチャースージングアンプル, 30ml",2800
2026-01-26,스킨케어_주간,100,KITEN,"ハイドロキノンクリーム, 20g",2980
2026-01-26,베이스_주간,1,23yearsold,ダーマシンコンシーラー,1580
2026-01-26,베이스_주간,2,エイプリルスキン,"ヒーロークッション, 本品+レフィル",3700
2026-01-26,베이스_주간,3,TFIT,トランスルーセントセットフィニッシングパウダー,1690
2026-01-26,베이스_주간,4,ABOUT TONE,"スキンレイヤーフィットファンデーション, 3ml",350
2026-01-26,베이스_주간,5,ブラン,"皮脂ゼロエアフィットクッション, 本品",2980
2026-01-26,베이스_주간,6,JUDYDOLL,メリハリマスターパレット,2090
2026-01-26,베이스_주간,7,ByUR,セラムフィットルースフェイスパウダー,2090
2026-01-26,베이스_주간,8,ABOUT TONE,スキンレイヤーフィットファンデーション,3080
2026-01-26,베이스_주간,9,ブイディーエル,"トーンステインカラーコレクティングプライマー, 30ml",3080
2026-01-26,베이스_주간,10,ジョンセンムル,"エッセンシャルスキンヌーダークッション, 本品",3440
2026-01-26,베이스_주간,11,TFIT,カバーアッププロコンシーラー,1590
2026-01-26,베이스_주간,12,ティルティル,"マスクフィットトーンアップエッセンス, 30ml",2970
2026-01-26,베이스_주간,13,アイムミミ,アイムマルチスティックデュアル,1593
2026-01-26,베이스_주간,14,glow,"ブリーザブルBBクリーム, 30ml",3740
2026-01-26,베이스_주간,15,PERFECT DIARY,エッセンスコンシーリング UV クッションファンデーション,2670
2026-01-26,베이스_주간,16,ラネージュ,"ネオクッションミューイ, 本品",3520
2026-01-26,베이스_주간,17,ウェイクメイク,"シームレスウェアファンデーション, 30ml, スパチュラブラシ付き",3230
2026-01-26,베이스_주간,18,タッチインソル,"ノーポアブレムプライマー, 30ml",2277
2026-01-26,베이스_주간,19,Funny Elves,ソフトマットプレストパウダー,2199
2026-01-26,베이스_주간,20,CHASIN’ RABBITS,"オールアバウトグロウカバークリーム, 35ml",1979
2026-01-26,베이스_주간,21,ナンバーズイン,5番 白玉グルタチオンＣトーンアップベース,2900
2026-01-26,베이스_주간,22,MAYBELLINE NEW YORK,"フィットミー リキッド ファンデーション R, 30ml",1650
2026-01-26,베이스_주간,23,スキンフード,サーモンダークサークルコンシーラークリーム,1100
2026-01-26,베이스_주간,24,エイプリルスキン,"マジックスノークッション, 本品+レフィル",3700
2026-01-26,베이스_주간,25,2ªN,ピュアグラッシュハイライター,1430
2026-01-26,베이스_주간,26,ウェイクメイク,"ウォーターグロウコーティングバーム, 本品+レフィル",3600
2026-01-26,베이스_주간,27,トゥークールフォースクール,アートクラスバイロダンシェーディング,1499
2026-01-26,베이스_주간,28,GIVERNY,"密着カバーファンデーション, ブラシ",999
2026-01-26,베이스_주간,29,YUNJAC,"スキンパーフェクティングプロテクティブベースプレップ, 25ml",3040
2026-01-26,베이스_주간,30,エイプリルスキン,トーンアップスキンティント,2364
2026-01-26,베이스_주간,31,ダルバ,"グロウフィットセラムカバークッション, 本品",3200
2026-01-26,베이스_주간,32,hince,トゥルーディメンションラディアンスバーム,2580
2026-01-26,베이스_주간,33,TFIT,アイシーフィットカバークッションEX,2790
2026-01-26,베이스_주간,34,NAMING,"レイヤードフィットクッション, 本品",2900
2026-01-26,베이스_주간,35,MAYBELLINE NEW YORK,SPステイ ルミマット リキッド ファンデーション,2992
2026-01-26,베이스_주간,36,ウェイクメイク,"シームレスウェアクッション, 本品+レフィル",3600
2026-01-26,베이스_주간,37,AGE 20'S,"シグネチャーエッセンスパクト, 本品+レフィル",3784
2026-01-26,베이스_주간,38,glow,ノットドライコンシーラー,3630
2026-01-26,베이스_주간,39,SISTER ANN,"ピンクエッセンスカバーパクト, 本品",3480
2026-01-26,베이스_주간,40,ブイディーエル,ローズPDRNプレップベース,3190
2026-01-26,베이스_주간,41,TFIT,"スキンカバーBB クリーム, 30g",1683
2026-01-26,베이스_주간,42,Forencos,タトゥーウォータープルーフスカーコンシーラー,1650
2026-01-26,베이스_주간,43,AGE 20'S,ビタシースキンケアトンアップ化粧下地,1615
2026-01-26,베이스_주간,44,23yearsold,ダーマシンゼロセバムライスパウダー,1490
2026-01-26,베이스_주간,45,セルフュージョンC,"スキンブレミッシュバームインテンシブ, 30ml",2880
2026-01-26,베이스_주간,46,hince,"セカンドスキングロウクッション, 本品",2816
2026-01-26,베이스_주간,47,クリオ,"メッシュグロウエッセンシャルクッション, 本品+レフィル",3560
2026-01-26,베이스_주간,48,パープリッシュ,"ソフトトーニングクッション, 本品",3490
2026-01-26,베이스_주간,49,エチュード,コントゥアスティック,1400
2026-01-26,베이스_주간,50,Dinto,雲楚ライトベール カラーコレクター&コンシーラー,1620
2026-01-26,베이스_주간,51,ラネージュ,"ネオクッション, 本品",3300
2026-01-26,베이스_주간,52,Ririmew,"トーンアップカラープライマー, 30ml",1760
2026-01-26,베이스_주간,53,クリオ,"キルカバーハイグロウクッション, 本品+レフィル",3190
2026-01-26,베이스_주간,54,ByUR,セラムフィットスキニーグロウリキッドファンデーション,3410
2026-01-26,베이스_주간,55,アンジエンド,ピンクプライマー,2680
2026-01-26,베이스_주간,56,オフラ,"ハイライター, ミニ",3630
2026-01-26,베이스_주간,57,ブイディーエル,"トーンステインカラーコレクティングプライマー, 13ml, 2個",3520
2026-01-26,베이스_주간,58,Funny Elves,ノートレースシースルーセッティングパウダー,2384
2026-01-26,베이스_주간,59,ペリペラ,ブイシェーディング,1500
2026-01-26,베이스_주간,60,Funny Elves,ロングウェアファンデーション,999
2026-01-26,베이스_주간,61,ウォンジョンヨ,"トーンアップベース N, 25g",1430
2026-01-26,베이스_주간,62,ティルティル,"マスクフィットトーンアップクリーム, 50ml",2420
2026-01-26,베이스_주간,63,HARIAS,クッションファンデーション + フェイスパウダー,7420
2026-01-26,베이스_주간,64,トゥークールフォースクール,ヴェールドコントゥア,2490
2026-01-26,베이스_주간,65,PERFECT DIARY,スターダストダイヤモンドハイライトパウダー,2690
2026-01-26,베이스_주간,66,エスポア,ストロービングハイライター,2805
2026-01-26,베이스_주간,67,ブイディーエル,"カバーステインパーフェクティングファンデーション, 30ml",3630
2026-01-26,베이스_주간,68,ティルティル,マスクフィットオールカバーデュアルコンシーラー,1815
2026-01-26,베이스_주간,69,ナンバーズイン,"3番 ノーファンデ陶器肌トーンアップクリーム, 50ml",2900
2026-01-26,베이스_주간,70,ミシャ,M スキンフェイクバーム,1980
2026-01-26,베이스_주간,71,AGE 20'S,ケアグロウハイライター「saki エディション」,1019
2026-01-26,베이스_주간,72,クリオ,"キルカバーファンウェアクッション, 本品＋レフィル",3560
2026-01-26,베이스_주간,73,TFIT,"ルミネアスキップトーンアップクリーム, 100g",1790
2026-01-26,베이스_주간,74,D-RAY,"D-クリアファンデーション, レフィル",1000
2026-01-26,베이스_주간,75,ブイディーエル,"カバーステインパーフェクティングクッションファンデーション, 本品",3630
2026-01-26,베이스_주간,76,クリオ,プリズムハイライト[25AD],2400
2026-01-26,베이스_주간,77,エチュード,コントゥアパウダー,2090
2026-01-26,베이스_주간,78,タッチインソル,ノーポアブレムミネラルパウダー,978
2026-01-26,베이스_주간,79,トゥークールフォースクール,アートクラスデュアルコントゥアスティック,1399
2026-01-26,베이스_주간,80,HARIAS,"クッションファンデーション, 本品",3520
2026-01-26,베이스_주간,81,JOOCYEE,ルミナスフィットペン,1650
2026-01-26,베이스_주간,82,D-RAY,"D-クリアファンデーション, 本品",1280
2026-01-26,베이스_주간,83,ブイディーエル,"トーンステインカラーコレクティングプライマー, 13ml, ",1760
2026-01-26,베이스_주간,84,TIMAGE,"ハイライトシェーディングパレット, ミニ, ブラシ,パフ",3168
2026-01-26,베이스_주간,85,ティルティル,シルエットコントゥアスティック,1760
2026-01-26,베이스_주간,86,BEAUDIANI,"メッシュタイトアップクッション, 本品",3680
2026-01-26,베이스_주간,87,SPICARE,"V3 インテリジェントファンデーション, 本品",9900
2026-01-26,베이스_주간,88,hince,"カバーマスターピンククッション, 本品",2816
2026-01-26,베이스_주간,89,NUDIQUE,"シアーグロウベース, 35ml",3200
2026-01-26,베이스_주간,90,カラーグラム,ぷるんジェリービームスティック,1400
2026-01-26,베이스_주간,91,ザセム,"カバーパーフェクションチップコンシーラー, 3個",1750
2026-01-26,베이스_주간,92,フィー,グリッツストーンハイライター,2090
2026-01-26,베이스_주간,93,クリオ,"キルカバーファンウェアクッションザオリジナル, 本品+レフィル",3560
2026-01-26,베이스_주간,94,NAMING,"ゼログラビティカバーフィットクッション, 本品",2900
2026-01-26,베이스_주간,95,ウォンジョンヨ,トーンアップフィルタークッション,2970
2026-01-26,베이스_주간,96,23yearsold,ハートリーフシンカバークッション,2380
2026-01-26,베이스_주간,97,タッチインソル,スキンカバークッション ,3500
2026-01-26,베이스_주간,98,MilleFée,チート顔コントゥアパレット,2390
2026-01-26,베이스_주간,99,hince,ラディアンスメイクアップブースティングプレップ,2380
2026-01-26,베이스_주간,100,シピシピ,フィットスキンクッション,2750
2026-01-26,포인트_주간,1,ロムアンド,ハンオールブロウカラ,1210
2026-01-26,포인트_주간,2,NAMING,デューアップハートリップグロス,1650
2026-01-26,포인트_주간,3,カラーグラム,ギークヌードカラーカバーティント,1190
2026-01-26,포인트_주간,4,エイプリルスキン,ヒーローリップタトゥーティント,1950
2026-01-26,포인트_주간,5,Laka,フルーティーグラムティント,1960
2026-01-26,포인트_주간,6,2ªN,デュアルチーク,1870
2026-01-26,포인트_주간,7,トゥークールフォースクール,プロタージュペンシル,1349
2026-01-26,포인트_주간,8,NAMING,オーバーデューグロッシーリップティント,1760
2026-01-26,포인트_주간,9,AZTK,ジェリーカラーチークリキッド,1290
2026-01-26,포인트_주간,10,アミューズ,ジェルフィットグロス,1584
2026-01-26,포인트_주간,11,インガ,パウダーブラーリップスティック,890
2026-01-26,포인트_주간,12,shaishaishai,サンキスドプランプリップバーム,1650
2026-01-26,포인트_주간,13,MAYBELLINE NEW YORK,SPフラッフブロウムース,1672
2026-01-26,포인트_주간,14,soaddicted,アイラッシュコンディショニングセラム アドバンス,11000
2026-01-26,포인트_주간,15,AOU,ブレンディングリップペンシル,1599
2026-01-26,포인트_주간,16,フィー,"3Dボリューミンググロス, 2個",3520
2026-01-26,포인트_주간,17,デイジーク,シャドウパレット,3800
2026-01-26,포인트_주간,18,ミルクタッチ,ジェリーフィットティンティッドグロウティント,1760
2026-01-26,포인트_주간,19,MARSHIQUE,セルフまつげパーマキット,3250
2026-01-26,포인트_주간,20,FEG,FEGまつ毛美容液,799
2026-01-26,포인트_주간,21,Mooekiss,ダブルエッセンスリップティント,1760
2026-01-26,포인트_주간,22,コスノリ,"イージーブロウチェンジャー, 5回分",2860
2026-01-26,포인트_주간,23,Laka,スージングプレップリップマスク,1930
2026-01-26,포인트_주간,24,EYE2IN,セルフまつげパーマ9種10回分セット,2499
2026-01-26,포인트_주간,25,Pyt,ゲンバリップティント,1980
2026-01-26,포인트_주간,26,クリオ,プロアイパレットエアー,2990
2026-01-26,포인트_주간,27,コスノリ,ロングアクティブアイラッシュセラム,1870
2026-01-26,포인트_주간,28,ノエット,"ベアシンスティック, 2個",2957
2026-01-26,포인트_주간,29,ロムアンド,ザジューシーラスティングティント,1320
2026-01-26,포인트_주간,30,LUMMIR,ライトオンアイズシャドウパレット,3300
2026-01-26,포인트_주간,31,NAMING,フラッフィーパウダーブラッシュ,1650
2026-01-26,포인트_주간,32,ウェイクメイク,ソフトブラーリングアイパレット,2790
2026-01-26,포인트_주간,33,シピシピ,デューイフィルムティントR,1430
2026-01-26,포인트_주간,34,ホリカホリカ,マイフェイブピースシャドウ,900
2026-01-26,포인트_주간,35,EYE2IN,セルフまつげパーマ5回分トライアルキット,1799
2026-01-26,포인트_주간,36,Laka,デビルリップ,1930
2026-01-26,포인트_주간,37,アミューズ,バナナリップオイル,1405
2026-01-26,포인트_주간,38,ラネージュ,"リップスリーピングマスクEX, 20g",2105
2026-01-26,포인트_주간,39,ノエット,ベアシンチーク,1562
2026-01-26,포인트_주간,40,ペリペラ,シロッピートックチーク,1390
2026-01-26,포인트_주간,41,SISTER ANN,"ウォータープルーフペンシルアイライナー, 2個",1980
2026-01-26,포인트_주간,42,ロムアンド,グラスティングカラーグロス,1320
2026-01-26,포인트_주간,43,デイジーク,プロスリムブロウカラ,1200
2026-01-26,포인트_주간,44,ミルクタッチ,スプレッドフィットブラーティント,1969
2026-01-26,포인트_주간,45,エチュード,カールフィックスマスカラ,1650
2026-01-26,포인트_주간,46,LEPOREM,"まつ毛美容液アイラッシュセラム, 2個",999
2026-01-26,포인트_주간,47,Dinto,ブラーグロウイリップティント,1870
2026-01-26,포인트_주간,48,デイジーク,プロディテールブロウペンシル,1400
2026-01-26,포인트_주간,49,ペリペラ,インクグラスティングリップグロス,1390
2026-01-26,포인트_주간,50,Laka,マキシグレイヤーティント,1930
2026-01-26,포인트_주간,51,EITHER&,デューイシロップティント,1633
2026-01-26,포인트_주간,52,ミルクタッチ,アイコニックマスカラ,1628
2026-01-26,포인트_주간,53,ペリペラ,ピュアブラッシュドサンシャインチーク,780
2026-01-26,포인트_주간,54,ノエット,ベアシンスティック,1663
2026-01-26,포인트_주간,55,ハートパーセント,ドットオンムードリップペンシル,1540
