일자,카테고리,순위,브랜드,상품명,가격
2026-01-07,전체_월간,1,メディキューブ,ブースタープロ,28889
2026-01-07,전체_월간,2,Brighte,エレキリフトリフ ト,22000
2026-01-07,전체_월간,3,ブラン,"マジックティーツリーオイル, 20ml",2790
2026-01-07,전체_월간,4,アヌア,"PDRNヒアルロン酸カプセル100セラム, 30ml",3200
2026-01-07,전체_월간,5,アヌア,"レチノール0.3ナイアシンリニューイングセラム, 30ml",3200
2026-01-07,전체_월간,6,エイプリルスキン,"ヒーロークッション, 本品+レフィル",3600
2026-01-07,전체_월간,7,アヌア,"ビタミン10PORESTRIXセラム, 20ml",2800
2026-01-07,전체_월간,8,アヌア,"PDRNヒアルロン酸ハイドレイティングミスト, 100ml",2650
2026-01-07,전체_월간,9,DPPR,"SOYキューブゲルマスクパック, 4枚",2650
2026-01-07,전체_월간,10,Laka,スージングプレップリップマスク,1890
2026-01-07,전체_월간,11,スキンアンドラブ,"グルタチオントナー, 200ml",2590
2026-01-07,전체_월간,12,カラーグラム,ギークヌードカラーカバーティント,1190
2026-01-07,전체_월간,13,セルフュージョンC,"コラーゲンPDRNアンプル, 35ml",2310
2026-01-07,전체_월간,14,ナンバーズイン,"5番 白玉グルタチオン100xTXA10集中トーニング美容液, 2個",4000
2026-01-07,전체_월간,15,トゥークールフォースクール,プロタージュペンシル,1499
2026-01-07,전체_월간,16,ULRUB,"ヘアマスク, 200g",3480
2026-01-07,전체_월간,17,ロムアンド,ハンオールブロウカラ,1210
2026-01-07,전체_월간,18,リジュラン,PDRN化粧水＋クリームセット,14000
2026-01-07,전체_월간,19,ミルクタッチ,ジェリーフィットティンティッドグロウティント,1707
2026-01-07,전체_월간,20,AZTK,ジェリーカラーチークリキッド,1165
2026-01-07,전체_월간,21,COSRX,"RXザアルファアルブチン2ニキビ跡ケアセラム, 50ml",2332
2026-01-07,전체_월간,22,ドクターディファレント,"ビタリフトＡフォルテ, 20g",4700
2026-01-07,전체_월간,23,トゥークールフォースクール,アートクラススマッジングアンダーライナー,1499
2026-01-07,전체_월간,24,エイプリルスキン,"リアルカロテンIPMPブレミッシュセラムパックパッド, 80枚",2800
2026-01-07,전체_월간,25,ブラン,"マジックシカクリーム, 60ml",4790
2026-01-07,전체_월간,26,ブラン,"皮脂ゼロエアフィットクッション, 本品",2980
2026-01-07,전체_월간,27,ホリカホリカ,マイフェイブピースシャドウ,600
2026-01-07,전체_월간,28,メディキューブ,"コウジ酸ビタナイアシントナー, 250ml",2300
2026-01-07,전체_월간,29,lily eve,"グロウターンアンプル, 100ml, 2個",5230
2026-01-07,전체_월간,30,AOU,ブレンディングリップペンシル,1119
2026-01-07,전체_월간,31,VTコスメティックス,"PDRNカプセルクリーム100, 50ml",2167
2026-01-07,전체_월간,32,ティルティル,マスクフィットルビーメッシュクッション,2821
2026-01-07,전체_월간,33,NAMING,オーバーデューグロッシーリップティント,1760
2026-01-07,전체_월간,34,コスノリ,"イージーブロウ·トーン·チェンジャー, 5回分",2400
2026-01-07,전체_월간,35,Laka,デビルリップ,1880
2026-01-07,전체_월간,36,KATAN,"シカダーマヒットセラム5, 30g",3740
2026-01-07,전체_월간,37,エイプリルスキン,ヒーローリップタトゥーティント,1950
2026-01-07,전체_월간,38,ブラン,トラブルケア2種セット,6880
2026-01-07,전체_월간,39,UIQ,"バイオームバリアパンテンシブクリーム, 50ml",2890
2026-01-07,전체_월간,40,アヌア,"ドクダミポアコントロールクレンジングオイル, 200ml",2100
2026-01-07,전체_월간,41,SKIN1004,"センテラアンプル, 55ml",2375
2026-01-07,전체_월간,42,Mooekiss,ダブルエッセンスリップティント,1554
2026-01-07,전체_월간,43,アヌア,"ナイアシンアミド10%ダークスポットセラム, 30ml",2800
2026-01-07,전체_월간,44,COSRX,"RXザビタミンC23セラム2世代, 20g",2389
2026-01-07,전체_월간,45,2ªN,デュアルチーク,1870
2026-01-07,전체_월간,46,バイオヒールボ,"プロバイオダーム3Dリフティングクリーム, 50ml, 本品+レフィル",5467
2026-01-07,전체_월간,47,RISKY,ピグメントアイシャドウパレット,3705
2026-01-07,전체_월간,48,アミューズ,ジェルフィットグロス,1760
2026-01-07,전체_월간,49,ABOUT TONE,"スキンレイヤーフィットファンデーション, 3ml",350
2026-01-07,전체_월간,50,La'dor ,"パフュームヘアオイル, 80ml",3700
2026-01-07,전체_월간,51,オフラ,"ハイライター, ミニ, 2個",4929
2026-01-07,전체_월간,52,PERFECT DIARY,"トランスルーシェントブラーリングセッティンクパウダー, 3g",1870
2026-01-07,전체_월간,53,Biodance,NEW X BEST 企画セット,3960
2026-01-07,전체_월간,54,オフラ,"ハイライター, ミニ",2541
2026-01-07,전체_월간,55,Dinto,"[クリスマス限定パッケージ]ブラーグロウイリップティント, ミニ, 3個",1361
2026-01-07,전체_월간,56,ルナ,コンシールブレンダーパレット,2350
2026-01-07,전체_월간,57,バイオヒールボ,"プロバイオダーム3Dリフティングクリーム, 50ml, ",3356
2026-01-07,전체_월간,58,soaddicted,アイラッシュコンディショニングセラム アドバンス,11000
2026-01-07,전체_월간,59,ラネージュ,"リップスリーピングマスクEX, 20g",2129
2026-01-07,전체_월간,60,KATAN,"シカダーマヒットセラム10, 30g",5720
2026-01-07,전체_월간,61,Kopher,"キュリペアメラクリーム, 35ml",3190
2026-01-07,전체_월간,62,manyo,"ガラクナイアシン3.0エッセンス, 30ml",2200
2026-01-07,전체_월간,63,ByUR,セラムフィットルースフェイスパウダー,1881
2026-01-07,전체_월간,64,One-day's you,ダクトパッドセット,2550
2026-01-07,전체_월간,65,BnD,"アンダーアームクリーム, 100g",3391
2026-01-07,전체_월간,66,AOU,"トーンアップぽよんクリーム, 100ml",1393
2026-01-07,전체_월간,67,FEG,FEGまつ毛美容液,899
2026-01-07,전체_월간,68,DPPR,"SOYキューブ豆乳セラム, 50ml",2650
2026-01-07,전체_월간,69,One-day's you,"スポットクリアトナー, 150ml",1350
2026-01-07,전체_월간,70,ウェイクメイク,"シームレスウェアファンデーション, 30ml, スパチュラブラシ付き",3380
2026-01-07,전체_월간,71,EYE2IN,セルフまつげパーマ9種10回分セット,2499
2026-01-07,전체_월간,72,原料工房,"アズレンブルークレンジングバーム, 100ml",2100
2026-01-07,전체_월간,73,ティルティル,"マスクフィットトーンアップエッセンス, 30ml",2673
2026-01-07,전체_월간,74,デイジーク,シャドウパレット,3800
2026-01-07,전체_월간,75,ABOUT TONE,スキンレイヤーフィットファンデーション,2772
2026-01-07,전체_월간,76,punbaki,"アデノシンピンクエッセンシャルトナー, 150ml",2950
2026-01-07,전체_월간,77,ミルクタッチ,アイコニックマスカラ,1579
2026-01-07,전체_월간,78,Kundal,"シャンプートリートメントセット, 本品+レフィル",3799
2026-01-07,전체_월간,79,ジョンセンムル,"エッセンシャルスキンヌーダークッション, 本品",3420
2026-01-07,전체_월간,80,トリデン,"ダイブインセラム, 80ml",2950
2026-01-07,전체_월간,81,ウェイクメイク,ソフトブラーリングアイパレット,2790
2026-01-07,전체_월간,82,スキンフード,サーモンダークサークルコンシーラークリーム,1100
2026-01-07,전체_월간,83,ルナ,バブルリングガムグロス,1530
2026-01-07,전체_월간,84,バイオヒールボ,"プロバイオダーム3Dリフティングアイ＆リンクルクリーム, 25ml, 2個",2750
2026-01-07,전체_월간,85,Yunth,"生VC美白美容液, 28個",3960
2026-01-07,전체_월간,86,Ytning,"リンパマッサージクリーム, 120ml",2835
2026-01-07,전체_월간,87,メディキューブ,"アゼライン酸ナイアシンアミドクリアトナー, 250ml",2300
2026-01-07,전체_월간,88,Funny Elves,ソフトマットプレストパウダー,2199
2026-01-07,전체_월간,89,アヌア,"3セラミドパンテノールモイスチャーバリアクリーム, 100ml",2800
2026-01-07,전체_월간,90,glow,"ブリーザブルBBクリーム, 30ml",3400
2026-01-07,전체_월간,91,ENTROPY MAKEUP,"ブロウブリーチ, 6個",4574
2026-01-07,전체_월간,92,RISKY,ビーボールドリップグロス,2280
2026-01-07,전체_월간,93,イズエンツリー,"超低分子ヒアルロン酸トナー, 300ml",2400
2026-01-07,전체_월간,94,ODELOI,"ブラックチェリー毛穴収縮クリームルフティグ, 100ml",2261
2026-01-07,전체_월간,95,クリオ,プロアイパレットエアー,2990
2026-01-07,전체_월간,96,manyo,"ピュアクレンジングオイル, 200ml",2200
2026-01-07,전체_월간,97,Kundal,プレミアムヘアケアスペシャルセット,2399
2026-01-07,전체_월간,98,メディキューブ,"ゼロ毛穴パッド 2.0, 70枚",2400
2026-01-07,전체_월간,99,CKD_GUARANTEED,"レチノコラーゲン低分子300毛穴弾力マスク, 5枚",2061
2026-01-07,전체_월간,100,LUMMIR,ライトオンアイズシャドウパレット,3300
2026-01-07,스킨케어_월간,1,ブラン,"マジックティーツリーオイル, 20ml",2790
2026-01-07,스킨케어_월간,2,アヌア,"PDRNヒアルロン酸カプセル100セラム, 30ml",3200
2026-01-07,스킨케어_월간,3,アヌア,"レチノール0.3ナイアシンリニューイングセラム, 30ml",3200
2026-01-07,스킨케어_월간,4,アヌア,"ビタミン10PORESTRIXセラム, 20ml",2800
2026-01-07,스킨케어_월간,5,アヌア,"PDRNヒアルロン酸ハイドレイティングミスト, 100ml",2650
2026-01-07,스킨케어_월간,6,DPPR,"SOYキューブゲルマスクパック, 4枚",2650
2026-01-07,스킨케어_월간,7,スキンアンドラブ,"グルタチオントナー, 200ml",2590
2026-01-07,스킨케어_월간,8,セルフュージョンC,"コラーゲンPDRNアンプル, 35ml",2310
2026-01-07,스킨케어_월간,9,ナンバーズイン,"5番 白玉グルタチオン100xTXA10集中トーニング美容液, 2個",4000
2026-01-07,스킨케어_월간,10,COSRX,"RXザアルファアルブチン2ニキビ跡ケアセラム, 50ml",2332
2026-01-07,스킨케어_월간,11,ドクターディファレント,"ビタリフトＡフォルテ, 20g",4700
2026-01-07,스킨케어_월간,12,エイプリルスキン,"リアルカロテンIPMPブレミッシュセラムパックパッド, 80枚",2800
2026-01-07,스킨케어_월간,13,ブラン,"マジックシカクリーム, 60ml",4790
2026-01-07,스킨케어_월간,14,メディキューブ,"コウジ酸ビタナイアシントナー, 250ml",2300
2026-01-07,스킨케어_월간,15,VTコスメティックス,"PDRNカプセルクリーム100, 50ml",2167
2026-01-07,스킨케어_월간,16,KATAN,"シカダーマヒットセラム5, 30g",3740
2026-01-07,스킨케어_월간,17,UIQ,"バイオームバリアパンテンシブクリーム, 50ml",2890
2026-01-07,스킨케어_월간,18,アヌア,"ドクダミポアコントロールクレンジングオイル, 200ml",2100
2026-01-07,스킨케어_월간,19,SKIN1004,"センテラアンプル, 55ml",2375
2026-01-07,스킨케어_월간,20,アヌア,"ナイアシンアミド10%ダークスポットセラム, 30ml",2800
2026-01-07,스킨케어_월간,21,COSRX,"RXザビタミンC23セラム2世代, 20g",2389
2026-01-07,스킨케어_월간,22,バイオヒールボ,"プロバイオダーム3Dリフティングクリーム, 50ml, 本品+レフィル",5467
2026-01-07,스킨케어_월간,23,Biodance,NEW X BEST 企画セット,3960
2026-01-07,스킨케어_월간,24,バイオヒールボ,"プロバイオダーム3Dリフティングクリーム, 50ml, ",3356
2026-01-07,스킨케어_월간,25,KATAN,"シカダーマヒットセラム10, 30g",5720
2026-01-07,스킨케어_월간,26,Kopher,"キュリペアメラクリーム, 35ml",3190
2026-01-07,스킨케어_월간,27,manyo,"ガラクナイアシン3.0エッセンス, 30ml",2200
2026-01-07,스킨케어_월간,28,One-day's you,ダクトパッドセット,2550
2026-01-07,스킨케어_월간,29,AOU,"トーンアップぽよんクリーム, 100ml",1393
2026-01-07,스킨케어_월간,30,DPPR,"SOYキューブ豆乳セラム, 50ml",2650
2026-01-07,스킨케어_월간,31,One-day's you,"スポットクリアトナー, 150ml",1350
2026-01-07,스킨케어_월간,32,原料工房,"アズレンブルークレンジングバーム, 100ml",2100
2026-01-07,스킨케어_월간,33,punbaki,"アデノシンピンクエッセンシャルトナー, 150ml",2950
2026-01-07,스킨케어_월간,34,トリデン,"ダイブインセラム, 80ml",2950
2026-01-07,스킨케어_월간,35,バイオヒールボ,"プロバイオダーム3Dリフティングアイ＆リンクルクリーム, 25ml, 2個",2750
2026-01-07,스킨케어_월간,36,Yunth,"生VC美白美容液, 28個",3960
2026-01-07,스킨케어_월간,37,メディキューブ,"アゼライン酸ナイアシンアミドクリアトナー, 250ml",2300
2026-01-07,스킨케어_월간,38,アヌア,"3セラミドパンテノールモイスチャーバリアクリーム, 100ml",2800
2026-01-07,스킨케어_월간,39,イズエンツリー,"超低分子ヒアルロン酸トナー, 300ml",2400
2026-01-07,스킨케어_월간,40,ODELOI,"ブラックチェリー毛穴収縮クリームルフティグ, 100ml",2261
2026-01-07,스킨케어_월간,41,manyo,"ピュアクレンジングオイル, 200ml",2200
2026-01-07,스킨케어_월간,42,メディキューブ,"ゼロ毛穴パッド 2.0, 70枚",2400
2026-01-07,스킨케어_월간,43,CKD_GUARANTEED,"レチノコラーゲン低分子300毛穴弾力マスク, 5枚",2061
2026-01-07,스킨케어_월간,44,AESTURA,"アトバリア365クリームミスト, 120ml",2500
2026-01-07,스킨케어_월간,45,KISOCARE,"ハイドロクリームPHQ-8, 20g",1480
2026-01-07,스킨케어_월간,46,SKIN1004,"センテラクイックカーミングパッド, 70枚",3135
2026-01-07,스킨케어_월간,47,celimax,"THEビタAレチナールショットタイトニングブースター, 15ml",2520
2026-01-07,스킨케어_월간,48,Redence,"トーン&スポットコレクターアンプル, 30ml",2565
2026-01-07,스킨케어_월간,49,アテニア,"スキンクリアクレンズオイル - 無香, 175ml",1980
2026-01-07,스킨케어_월간,50,トゥヴェール,"ナノエマルジョンディープ, 60ml",3610
2026-01-07,스킨케어_월간,51,センテリアン24,マデカクリームシグネチャーエディション,4100
2026-01-07,스킨케어_월간,52,ウェルダーマ,"ティーツリースージングハーブトックスピーリングパック, 150g",2160
2026-01-07,스킨케어_월간,53,センテリアン24,パック尽くしセット,3470
2026-01-07,스킨케어_월간,54,セラディックス,"トリプルレチノールウォッシュピール, 30ml",3400
2026-01-07,스킨케어_월간,55,ナンバーズイン,"5番 白玉グルタチオンＣ美容液, 30ml",2800
2026-01-07,스킨케어_월간,56,Kopher,"キュリペアSOSメルダーシステム, 1.5ml, 20本",5090
2026-01-07,스킨케어_월간,57,スキンアンドラブ,"レチノールリペアセラム, 30ml",2690
2026-01-07,스킨케어_월간,58,セラディックス,"ビタKダーククリア アイクリーム, 15ml",2300
2026-01-07,스킨케어_월간,59,LUVUM,"スローエイジングフィトコラーゲンゲルシートマスク, 5枚",2720
2026-01-07,스킨케어_월간,60,オーズナリー,"ビタ３セラム, 50ml",2850
2026-01-07,스킨케어_월간,61,KLALAB,"パンテカインテンシブクレンジングフォーム, 150ml",1800
2026-01-07,스킨케어_월간,62,イニスフリー,"グリーンティーセラミドミルクエッセンストナー, 160ml",2373
2026-01-07,스킨케어_월간,63,Biodance,NEW X BEST 1+1 企画セット,6750
2026-01-07,스킨케어_월간,64,ラゴム,"ジェルトゥウォータークレンザー [朝洗顔], 220ml",2310
2026-01-07,스킨케어_월간,65,セラディックス,131パッケージセット,3600
2026-01-07,스킨케어_월간,66,セルフュージョンC,"レーザーリジュベネーションクリーム, 50ml",2426
2026-01-07,스킨케어_월간,67,irecipe,"シカPDRN跡クリアトナーパッド, 70枚",1407
2026-01-07,스킨케어_월간,68,COSRX,"RXザ6ペプチドスキンブースターセラム, 150ml",2200
2026-01-07,스킨케어_월간,69,COSRX,"フルフィットプロポリスシナジートナー, 150ml",1690
2026-01-07,스킨케어_월간,70,AESTURA,"アトバリア365ローション, 150ml",3300
2026-01-07,스킨케어_월간,71,ダルバ,"ホワイトトリュフファーストスプレーセラム, 100ml",2700
2026-01-07,스킨케어_월간,72,スキンアンドラブ,"TXナイアシンエッセンストナー, 200ml",2590
2026-01-07,스킨케어_월간,73,メディヒール,"ホワイトミルクブライトニングトナー, 300ml",2518
2026-01-07,스킨케어_월간,74,メディキューブ,"コウジ酸ビタピールショット, 80ml",2400
2026-01-07,스킨케어_월간,75,Yunth,"マルチスクエアシートマスク, 120枚",2640
2026-01-07,스킨케어_월간,76,ブラン,"9倍濃縮したドクダミ化粧水, 300ml, ",3200
2026-01-07,스킨케어_월간,77,エッセンシエル,"ハイドラフォルテセラム, 50ml",2690
2026-01-07,스킨케어_월간,78,UIQ,"バイオームバリアクリームミスト, 50ml",4770
2026-01-07,스킨케어_월간,79,アヌア,"PDRNヒアルロン酸100モイスチャライジングクリーム, 60ml",3200
2026-01-07,스킨케어_월간,80,Sung Boon Editor,"シルクペプチドEGFハートフィットボリュームアンプル, 40ml",2850
2026-01-07,스킨케어_월간,81,ドクタージー,"レッドブレミッシュクリアスージングクリーム, 70ml",1944
2026-01-07,스킨케어_월간,82,SCHONU,"マルチバーム, 15g",1600
2026-01-07,스킨케어_월간,83,パーフェクトワンフォーカス,"スムースクレンジングバーム [ディープブラック], 75g",2821
2026-01-07,스킨케어_월간,84,ダルバ,"オールデイセラムメイクアップフィクサー, 80ml",3200
2026-01-07,스킨케어_월간,85,アイオペ,"レチノールレチジェクションセラム2%, 30ml",6018
2026-01-07,스킨케어_월간,86,Purelica,"スローエイジングH.A.クリーム, 50ml",5500
2026-01-07,스킨케어_월간,87,ブラン,"マジックティーツリーオイル, 20ml, 2個",5020
2026-01-07,스킨케어_월간,88,ラゴム,"ジェルトゥウォータークレンザー [朝洗顔], 220ml, 2個",4400
2026-01-07,스킨케어_월간,89,トゥヴェール,"レチノショット 0.1, 30g",3980
2026-01-07,스킨케어_월간,90,メディキューブ,"アゼライン酸16BBカーミングセラム, 30ml",2800
2026-01-07,스킨케어_월간,91,ベントン,"ビタミンCセラム, 30ml",2690
2026-01-07,스킨케어_월간,92,KITEN,"レチノールシカクリーム, 20g",2980
2026-01-07,스킨케어_월간,93,トリデン,"セルメイジングビタCアンプル, 30ml",1980
2026-01-07,스킨케어_월간,94,センテリアン24,"エキスパートマデカクリームリニューPDRN, 50ml",2860
2026-01-07,스킨케어_월간,95,SKIN1004,"プロバイオシカインテンシブアンプル, 50ml",2945
2026-01-07,스킨케어_월간,96,リジュラン,ゴールドセット,9184
2026-01-07,스킨케어_월간,97,ブラン,"毛穴アンプル, 30ml, 2個",3880
2026-01-07,스킨케어_월간,98,イニスフリー,"グリーンティーセラミドバリアクリーム, 50ml",2863
2026-01-07,스킨케어_월간,99,ONUL31,"フコイダンカーミング&バランシングマスク, 5枚",1020
2026-01-07,스킨케어_월간,100,アヌア,"ライスブライトニング酵素洗顔パウダー, 40g",1950
2026-01-07,베이스_월간,1,エイプリルスキン,"ヒーロークッション, 本品+レフィル",3600
2026-01-07,베이스_월간,2,ブラン,"皮脂ゼロエアフィットクッション, 本品",2980
2026-01-07,베이스_월간,3,ティルティル,マスクフィットルビーメッシュクッション,2821
2026-01-07,베이스_월간,4,ABOUT TONE,"スキンレイヤーフィットファンデーション, 3ml",350
2026-01-07,베이스_월간,5,オフラ,"ハイライター, ミニ, 2個",4929
2026-01-07,베이스_월간,6,PERFECT DIARY,"トランスルーシェントブラーリングセッティンクパウダー, 3g",1870
2026-01-07,베이스_월간,7,オフラ,"ハイライター, ミニ",2541
2026-01-07,베이스_월간,8,ルナ,コンシールブレンダーパレット,2350
2026-01-07,베이스_월간,9,ByUR,セラムフィットルースフェイスパウダー,1881
2026-01-07,베이스_월간,10,ウェイクメイク,"シームレスウェアファンデーション, 30ml, スパチュラブラシ付き",3380
2026-01-07,베이스_월간,11,ティルティル,"マスクフィットトーンアップエッセンス, 30ml",2673
2026-01-07,베이스_월간,12,ABOUT TONE,スキンレイヤーフィットファンデーション,2772
2026-01-07,베이스_월간,13,ジョンセンムル,"エッセンシャルスキンヌーダークッション, 本品",3420
2026-01-07,베이스_월간,14,スキンフード,サーモンダークサークルコンシーラークリーム,1100
2026-01-07,베이스_월간,15,Funny Elves,ソフトマットプレストパウダー,2199
2026-01-07,베이스_월간,16,glow,"ブリーザブルBBクリーム, 30ml",3400
2026-01-07,베이스_월간,17,アイムミミ,アイムマルチスティックデュアル,1440
2026-01-07,베이스_월간,18,EITHER&,エッグスリックファンデーション+リップオイルセット,4300
2026-01-07,베이스_월간,19,ナンバーズイン,5番 白玉グルタチオンＣトーンアップベース,2500
2026-01-07,베이스_월간,20,ブイディーエル,"トーンステインカラーコレクティングプライマー, 30ml",2980
2026-01-07,베이스_월간,21,TFIT,カバーアッププロコンシーラー,1467
2026-01-07,베이스_월간,22,ルナ,コンシールブレンダーパレット,2350
2026-01-07,베이스_월간,23,JUDYDOLL,メリハリマスターパレット,1986
2026-01-07,베이스_월간,24,tam BEAUTY,ザ・ゼリービームハイライター,1995
2026-01-07,베이스_월간,25,エイプリルスキン,"マジックスノークッション 3.0, 本品+レフィル",3600
2026-01-07,베이스_월간,26,2ªN,ピュアグラッシュハイライター,1430
2026-01-07,베이스_월간,27,glow,ノットドライコンシーラー,3322
2026-01-07,베이스_월간,28,hince,トゥルーディメンションラディアンスバーム,2580
2026-01-07,베이스_월간,29,MAYBELLINE NEW YORK,"フィットミー リキッド ファンデーション R, 30ml",1700
2026-01-07,베이스_월간,30,トゥークールフォースクール,アートクラスバイロダンシェーディング,1738
2026-01-07,베이스_월간,31,ティルティル,"マスクフィットレッドクッション, 本品",2821
2026-01-07,베이스_월간,32,ウェイクメイク,"ウォーターグロウコーティングバーム, 本品+レフィル",2890
2026-01-07,베이스_월간,33,クリオ,"メッシュグロウエッセンシャルクッション, 本品+レフィル",3560
2026-01-07,베이스_월간,34,TFIT,アイシーフィットカバークッションEX,2543
2026-01-07,베이스_월간,35,ダルバ,"グロウフィットセラムカバークッション, 本品",2900
2026-01-07,베이스_월간,36,hince,"セカンドスキングロウクッション, 本品",2816
2026-01-07,베이스_월간,37,フィー,"クッショングラスナチュラル, 本品",2860
2026-01-07,베이스_월간,38,ブリーブリー,"オーラハニーグロウクッション, 本品＋レフィル",1190
2026-01-07,베이스_월간,39,ラネージュ,"ネオクッションミューイ, 本品",3200
2026-01-07,베이스_월간,40,PERFECT DIARY,フローレスクッションファンデーション,2970
2026-01-07,베이스_월간,41,ティルティル,"マスクフィットオールカバークッション, 本品",2821
2026-01-07,베이스_월간,42,23yearsold,ダーマシンゼロセバムライスパウダー,1490
2026-01-07,베이스_월간,43,フィー,"クッショングラスオリジナル, 本品",2860
2026-01-07,베이스_월간,44,エチュード,ポンポンヘアシャドウ,1950
2026-01-07,베이스_월간,45,TFIT,"スキンカバーBB クリーム, 30g",1662
2026-01-07,베이스_월간,46,ブイディーエル,ローズPDRNプレップベース,3090
2026-01-07,베이스_월간,47,フィー,ファンデーショングラス,2673
2026-01-07,베이스_월간,48,Funny Elves,ノートレースシースルーセッティングパウダー,2384
2026-01-07,베이스_월간,49,ティルティル,"マスクフィットレッドファンデーション, 30ml",2821
2026-01-07,베이스_월간,50,ByUR,セラムフィットスキニーグロウリキッドファンデーション,3069
2026-01-07,베이스_월간,51,YUNJAC,"スキンパーフェクティングプロテクティブベースプレップ, 25ml",3040
2026-01-07,베이스_월간,52,Forencos,タトゥーウォータープルーフスカーコンシーラー,1650
2026-01-07,베이스_월간,53,ルナ,"ロングラスティングチップコンシーラー, 7.5g",1620
2026-01-07,베이스_월간,54,セルフュージョンC,"スキンブレミッシュバームインテンシブ, 30ml",2520
