일자,카테고리,순위,브랜드,상품명,가격
2026-01-07,베이스_월간,55,PERFECT DIARY,スターダストダイヤモンドハイライトパウダー,2656
2026-01-07,베이스_월간,56,オフラ,ミニハイライター+ブラッシャーセット,4556
2026-01-07,베이스_월간,57,デュイセル,"ポアーテンクリーム, 40ml, 2個",4500
2026-01-07,베이스_월간,58,SISTER ANN,"ピンクエッセンスカバーパクト, 本品",2490
2026-01-07,베이스_월간,59,D-RAY,"D-クリアファンデーション, 本品",1380
2026-01-07,베이스_월간,60,ティルティル,マスクフィットオールカバーデュアルコンシーラー,1724
2026-01-07,베이스_월간,61,4YE,"ピンクダイヤクッション, 本品+レフィル",4300
2026-01-07,베이스_월간,62,デュイセル,"ポアーテンクリーム, 40ml",2660
2026-01-07,베이스_월간,63,シピシピ,フィットスキンクッション,2139
2026-01-07,베이스_월간,64,ブイディーエル,"トーンステインカラーコレクティングプライマー, 13ml, 2個",3320
2026-01-07,베이스_월간,65,ティルティル,"マスクフィットAIフィルタークッション, 本品",2821
2026-01-07,베이스_월간,66,ウォンジョンヨ,"トーンアップベース N, 25g",1430
2026-01-07,베이스_월간,67,Ririmew,"トーンアップカラープライマー, 30ml",1760
2026-01-07,베이스_월간,68,ブイディーエル,"カバーステインパーフェクティングファンデーション, 30ml",3530
2026-01-07,베이스_월간,69,ティルティル,シルエットコントゥアスティック,1584
2026-01-07,베이스_월간,70,ウェイクメイク,"シームレスウェアクッション, 本品+レフィル",2890
2026-01-07,베이스_월간,71,クリオ,"キルカバーファンウェアクッション, 本品＋レフィル",3560
2026-01-07,베이스_월간,72,ルナ,アーティストミキシングコンシーラー,2350
2026-01-07,베이스_월간,73,SPICARE,"V3 インテリジェントファンデーション, 本品",9900
2026-01-07,베이스_월간,74,ABOUT TONE,"ウォーターレイヤーフィットクッション, 本品",2871
2026-01-07,베이스_월간,75,ジョンセンムル,血色メイクセット,6000
2026-01-07,베이스_월간,76,tam BEAUTY,ザ・ゼリースキンクッション,2160
2026-01-07,베이스_월간,77,ルナ,グラインディングコンシールバター,2350
2026-01-07,베이스_월간,78,ナンバーズイン,"3番 ノーファンデ陶器肌トーンアップクリーム, 50ml",2500
2026-01-07,베이스_월간,79,TFIT,"ルミネアスキップトーンアップクリーム, 100g",1662
2026-01-07,베이스_월간,80,ティルティル,"マスクフィットトーンアップクリーム, 50ml",2178
2026-01-07,베이스_월간,81,ティルティル,"マスクフィットクリスタルメッシュクッション, 本品",2821
2026-01-07,베이스_월간,82,CHASIN’ RABBITS,"オールアバウトグロウカバークリーム, 35ml",2090
2026-01-07,베이스_월간,83,アンジエンド,ピンクプライマー,2221
2026-01-07,베이스_월간,84,Dinto,雲楚ライトベール カラーコレクター&コンシーラー,1458
2026-01-07,베이스_월간,85,ジョンセンムル,"エッセンシャルスキンヌーダーロングウェアクッション, 本品+レフィル",4950
2026-01-07,베이스_월간,86,ウェイクメイク,ディファイニングカバーコンシーラー,1490
2026-01-07,베이스_월간,87,フィー,グリッツストーンハイライター,2090
2026-01-07,베이스_월간,88,HARIAS,"クッションファンデーション, 本品",2933
2026-01-07,베이스_월간,89,ザセム,"カバーパーフェクションチップコンシーラー, 3個",1550
2026-01-07,베이스_월간,90,hince,"カバーマスターピンククッション, 本品",2816
2026-01-07,베이스_월간,91,ラネージュ,"ネオクッション, 本品",3000
2026-01-07,베이스_월간,92,エスポア,ストロービングハイライター,2805
2026-01-07,베이스_월간,93,トゥークールフォースクール,ヴェールドコントゥア,2490
2026-01-07,베이스_월간,94,オフラ,ハイライター,4312
2026-01-07,베이스_월간,95,Funny Elves,ロングウェアファンデーション,999
2026-01-07,베이스_월간,96,ABOUT TONE,スキンレイヤーカバーフィットコンシーラー,1254
2026-01-07,베이스_월간,97,イニスフリー,"ノーセバムミネラルパウダー, 5g",890
2026-01-07,베이스_월간,98,ロムアンド,ベターザンコントゥア,2400
2026-01-07,베이스_월간,99,ブイディーエル,"カバーステインパーフェクティングファンデーション, 30ml",3530
2026-01-07,베이스_월간,100,ウォンジョンヨ,フィクシングブラーパウダーN,2420
2026-01-07,포인트_월간,1,Laka,スージングプレップリップマスク,1890
2026-01-07,포인트_월간,2,カラーグラム,ギークヌードカラーカバーティント,1190
2026-01-07,포인트_월간,3,トゥークールフォースクール,プロタージュペンシル,1499
2026-01-07,포인트_월간,4,ロムアンド,ハンオールブロウカラ,1210
2026-01-07,포인트_월간,5,ミルクタッチ,ジェリーフィットティンティッドグロウティント,1707
2026-01-07,포인트_월간,6,AZTK,ジェリーカラーチークリキッド,1165
2026-01-07,포인트_월간,7,トゥークールフォースクール,アートクラススマッジングアンダーライナー,1499
2026-01-07,포인트_월간,8,ホリカホリカ,マイフェイブピースシャドウ,600
2026-01-07,포인트_월간,9,AOU,ブレンディングリップペンシル,1119
2026-01-07,포인트_월간,10,NAMING,オーバーデューグロッシーリップティント,1760
2026-01-07,포인트_월간,11,コスノリ,"イージーブロウ·トーン·チェンジャー, 5回分",2400
2026-01-07,포인트_월간,12,Laka,デビルリップ,1880
2026-01-07,포인트_월간,13,エイプリルスキン,ヒーローリップタトゥーティント,1950
2026-01-07,포인트_월간,14,Mooekiss,ダブルエッセンスリップティント,1554
2026-01-07,포인트_월간,15,2ªN,デュアルチーク,1870
2026-01-07,포인트_월간,16,RISKY,ピグメントアイシャドウパレット,3705
2026-01-07,포인트_월간,17,アミューズ,ジェルフィットグロス,1760
2026-01-07,포인트_월간,18,Dinto,"[クリスマス限定パッケージ]ブラーグロウイリップティント, ミニ, 3個",1361
2026-01-07,포인트_월간,19,soaddicted,アイラッシュコンディショニングセラム アドバンス,11000
2026-01-07,포인트_월간,20,ラネージュ,"リップスリーピングマスクEX, 20g",2129
2026-01-07,포인트_월간,21,FEG,FEGまつ毛美容液,899
2026-01-07,포인트_월간,22,EYE2IN,セルフまつげパーマ9種10回分セット,2499
2026-01-07,포인트_월간,23,デイジーク,シャドウパレット,3800
2026-01-07,포인트_월간,24,ミルクタッチ,アイコニックマスカラ,1579
2026-01-07,포인트_월간,25,ウェイクメイク,ソフトブラーリングアイパレット,2790
2026-01-07,포인트_월간,26,ルナ,バブルリングガムグロス,1530
2026-01-07,포인트_월간,27,ENTROPY MAKEUP,"ブロウブリーチ, 6個",4574
2026-01-07,포인트_월간,28,RISKY,ビーボールドリップグロス,2280
2026-01-07,포인트_월간,29,クリオ,プロアイパレットエアー,2990
2026-01-07,포인트_월간,30,LUMMIR,ライトオンアイズシャドウパレット,3300
2026-01-07,포인트_월간,31,ロムアンド,ザジューシーラスティングティント,1320
2026-01-07,포인트_월간,32,コスノリ,ロングアクティブアイラッシュセラム,1770
2026-01-07,포인트_월간,33,Laka,マキシグレイヤーティント,1830
2026-01-07,포인트_월간,34,エチュード,カールフィックスマスカラ,1600
2026-01-07,포인트_월간,35,Laka,フルーティーグラムティント,1830
2026-01-07,포인트_월간,36,ティルティル,ウォーターリズムグロウティント,1633
2026-01-07,포인트_월간,37,Pyt,ゲンバリップティント,1960
2026-01-07,포인트_월간,38,Laka,ラブシルクブラッシュ,1980
2026-01-07,포인트_월간,39,Dinto,ブラーグロウイリップティント,1683
2026-01-07,포인트_월간,40,ロムアンド,グラスティングカラーグロス,1320
2026-01-07,포인트_월간,41,SOONOUN,"コラーゲンエンリッチまつげセラム, 10ml",2690
2026-01-07,포인트_월간,42,tam BEAUTY,ザ・ゼリーミルキーチークブラッシャー,1233
2026-01-07,포인트_월간,43,EITHER&,デューイシロップティント,1633
2026-01-07,포인트_월간,44,ロムアンド,ベターザンパレット,3100
2026-01-07,포인트_월간,45,ラネージュ,グレイズティントリップセラム,2100
2026-01-07,포인트_월간,46,ミルクタッチ,オーナメントプリズムシャインパールグロス,2407
2026-01-07,포인트_월간,47,AOU,ソフトクリームチーク,1435
2026-01-07,포인트_월간,48,BRAYE,シングロウティント,2272
2026-01-07,포인트_월간,49,RISKY,ビーボールドリップブラッシュド,2280
2026-01-07,포인트_월간,50,RISKY,アイシャドウパレット&リップブラッシュド,5670
2026-01-07,포인트_월간,51,ホリカホリカ,マイフェイブムードアイシャドウパレット,2345
2026-01-07,포인트_월간,52,ペリペラ,シロッピートックチーク,1390
2026-01-07,포인트_월간,53,ブイディーエル,チークステインブラッシャー,2210
2026-01-07,포인트_월간,54,Dinto,ブラーグロウイリップティント企画セット,1361
2026-01-07,포인트_월간,55,EYE2IN,セルフまつげパーマ5回分トライアルキット,1799
2026-01-07,포인트_월간,56,LEPOREM,"セルフまつ毛カールキット, 5回分",1580
2026-01-07,포인트_월간,57,リリーバイレッド,ラブビームチークバーム,1320
2026-01-07,포인트_월간,58,ブイディーエル,チークステインリキッドブラッシャー,1880
2026-01-07,포인트_월간,59,ミュード,インスパイアスキニーブロウカラ,1400
2026-01-07,포인트_월간,60,ペリペラ,インクグラスティングリップグロス,1390
2026-01-07,포인트_월간,61,カラーグラム,ヌーディーブラーティント,1190
2026-01-07,포인트_월간,62,トゥークールフォースクール,スウェイリップベルベット,1740
2026-01-07,포인트_월간,63,ペリペラ,インクグラスティングリップグロス,1190
2026-01-07,포인트_월간,64,TOCOBO,ジューシーベリープランピングリップオイル,1440
2026-01-07,포인트_월간,65,BBIA,レディトゥウェアアイパレット,1500
2026-01-07,포인트_월간,66,エチュード,ジンジャーシュガーリップセラム,1400
2026-01-07,포인트_월간,67,ロムアンド,ケミハートアドベントカレンダー,6200
2026-01-07,포인트_월간,68,クリオ,ベルベットリップライナー,1400
2026-01-07,포인트_월간,69,JUDYDOLL,わがままチークハイライター,1795
2026-01-07,포인트_월간,70,NAMING,フラッフィーパウダーブラッシュ,1650
2026-01-07,포인트_월간,71,BBIA,グロウリップティント,1500
2026-01-07,포인트_월간,72,ハートパーセント,ドットオンムードリップペンシル,1490
2026-01-07,포인트_월간,73,ラネージュ,リップグロウィバーム,1870
2026-01-07,포인트_월간,74,ミルクタッチ,スプレッドフィットブラーティント,1769
2026-01-07,포인트_월간,75,トリデン,セルメイジングコラーゲンリップエッセンス,990
2026-01-07,포인트_월간,76,ペリペラ,ピュアブラッシュドサンシャインチーク,784
2026-01-07,포인트_월간,77,SISTER ANN,ウォータープルーフペンシルアイライナー,990
2026-01-07,포인트_월간,78,RISKY,"ビーボールドリップグロス, 2個",4320
2026-01-07,포인트_월간,79,JOOCYEE,とろ蜜リップペン,1590
2026-01-07,포인트_월간,80,フィー,"3Dボリューミングティント, 2個",3100
2026-01-07,포인트_월간,81,Laka,フルーティーリップグロッショナー,1800
2026-01-07,포인트_월간,82,インガ,ウォーターグロウリップティント,1690
2026-01-07,포인트_월간,83,Laka,ボンディンググロウリップスティック,2060
2026-01-07,포인트_월간,84,LEPOREM,まつ毛美容液アイラッシュセラム,1019
2026-01-07,포인트_월간,85,ICLIONE,"セルフまつげパーマ, 10回分",2350
2026-01-07,포인트_월간,86,ミュード,インスパイアスキニーマスカラ&マルチフィクサー,1500
2026-01-07,포인트_월간,87,クリオ,クリスタルグラムバーム,1700
2026-01-07,포인트_월간,88,クリオ,プロアイパレットキューブ,2100
2026-01-07,포인트_월간,89,ノエット,ベアシンスティック,2376
2026-01-07,포인트_월간,90,ロムアンド,ハンオールアイポットライナー,1700
2026-01-07,포인트_월간,91,ウェイクメイク,ソフトシアーマルチパレット,2450
2026-01-07,포인트_월간,92,コスノリ,"セルフまつ毛パーマキット, 5回分",2970
2026-01-07,포인트_월간,93,MilleFée,シェイクドロップチーク,1950
2026-01-07,포인트_월간,94,ペリペラ,パフィープランピングデューリップペンシル,1200
2026-01-07,포인트_월간,95,BBIA,オーバーグレイズ,1400
2026-01-07,포인트_월간,96,ジョンセンムル,アーティストアイパレット,5300
2026-01-07,포인트_월간,97,ノエット,ベアシンチーク,2232
2026-01-07,포인트_월간,98,SISTER ANN,"ウォータープルーフペンシルアイライナー, 2個",1880
2026-01-07,포인트_월간,99,フィー,メロウデュアルチーク,2090
2026-01-07,포인트_월간,100,デイジーク,ムードシャドウパレット,4490
2026-02-01,전체_월간,1,23yearsold,ダーマシンコンシーラー,1280
2026-02-01,전체_월간,2,アヌア,"ビタミン10PORESTRIXセラム, 20ml",2268
2026-02-01,전체_월간,3,アヌア,"レチノール0.3ナイアシンリニューイングセラム, 30ml",2592
2026-02-01,전체_월간,4,エイプリルスキン,ヒーローリップタトゥーティント,1579
2026-02-01,전체_월간,5,エイプリルスキン,"ヒーロークッション, 本品+レフィル",2997
2026-02-01,전체_월간,6,COSRX,"RXザアルファアルブチン2ニキビ跡ケアセラム, 50ml",1908
2026-02-01,전체_월간,7,ロムアンド,ハンオールブロウカラ,980
2026-02-01,전체_월간,8,ブラン,"マジックティーツリーオイル, 20ml",2260
2026-02-01,전체_월간,9,Redence,"リアルPDRNコラーゲンアンプル, 30ml",2531
2026-02-01,전체_월간,10,NAMING,オーバーデューグロッシーリップティント,1426
2026-02-01,전체_월간,11,ABOUT TONE,"スキンレイヤーフィットファンデーション, 3ml",350
2026-02-01,전체_월간,12,AROCELL,"スーパーコラーゲンマスク, 4枚",2100
2026-02-01,전체_월간,13,エイプリルスキン,"リアルカロテンIPMPブレミッシュセラムパックパッド, 80枚",2187
2026-02-01,전체_월간,14,hince,ニューブラーティント,1524
2026-02-01,전체_월간,15,メディキューブ,"PDRNピンクペプチドアンプル, 30ml",2268
2026-02-01,전체_월간,16,2ªN,デュアルチーク,1515
2026-02-01,전체_월간,17,AZTK,ジェリーカラーチークリキッド,1045
2026-02-01,전체_월간,18,スキンアンドラブ,"グルタチオントナー, 200ml",2098
2026-02-01,전체_월간,19,SKIN1004,"センテラアンプル, 55ml",1923
2026-02-01,전체_월간,20,Brighte,エレキリフトリフ ト,16038
2026-02-01,전체_월간,21,アヌア,"ナイアシンアミド10%ダークスポットセラム, 30ml",2268
2026-02-01,전체_월간,22,celimax,"THEビタAレチナールショットタイトニングブースター, 15ml",2025
2026-02-01,전체_월간,23,VTコスメティックス,"PDRNカプセルクリーム100, 50ml",1782
2026-02-01,전체_월간,24,AOU,ブレンディングリップペンシル,1295
2026-02-01,전체_월간,25,アヌア,"PDRNヒアルロン酸ハイドレイティングミスト, 100ml",2146
2026-02-01,전체_월간,26,"dear,Klairs","PDRNビタペプチド毛穴リペアセラム, 35ml",2068
2026-02-01,전체_월간,27,カラーグラム,ギークヌードカラーカバーティント,964
2026-02-01,전체_월간,28,lily eve,"グロウターンアンプル, 100ml, 2個",4536
2026-02-01,전체_월간,29,メディキューブ,"コウジ酸ビタナイアシントナー, 250ml",1863
2026-02-01,전체_월간,30,パパレシピ,"リアルセンテラシカデイリークイッククーリングマスク, 30枚",2179
2026-02-01,전체_월간,31,ブラン,"皮脂ゼロエアフィットクッション, 本品",2414
2026-02-01,전체_월간,32,アヌア,"ドクダミポアコントロールクレンジングオイル, 200ml",1863
2026-02-01,전체_월간,33,COSRX,"RXザビタミンC23セラム2世代, 20g",2171
2026-02-01,전체_월간,34,ブラン,"マジックシカクリーム, 60ml",3880
2026-02-01,전체_월간,35,TFIT,トランスルーセントセットフィニッシングパウダー,1369
2026-02-01,전체_월간,36,FEG,FEGまつ毛美容液,737
2026-02-01,전체_월간,37,ミルクタッチ,ジェリーフィットティンティッドグロウティント,1426
2026-02-01,전체_월간,38,OIAD,スレインハイパーグロウ,1369
2026-02-01,전체_월간,39,ナンバーズイン,"5番 白玉グルタチオン100xTXA10集中トーニング美容液, 2個",3888
2026-02-01,전체_월간,40,イズエンツリー,"超低分子ヒアルロン酸トナー, 300ml",1960
2026-02-01,전체_월간,41,Kopher,"キュリペアメラクリーム, 35ml",2997
2026-02-01,전체_월간,42,MilleFée,ちいかわメイクパフコンプリートボックス,3523
2026-02-01,전체_월간,43,Laka,フルーティーグラムティント,1588
2026-02-01,전체_월간,44,ululis,たっぷりうるおう4ヶ月アクアモイストケアセット,3349
2026-02-01,전체_월간,45,Laka,スージングプレップリップマスク,1563
2026-02-01,전체_월간,46,JUDYDOLL,メリハリマスターパレット,1448
2026-02-01,전체_월간,47,soaddicted,アイラッシュコンディショニングセラム アドバンス,11000
2026-02-01,전체_월간,48,ジョリーアウアー,"ヤムヤムセラム, 50ml",1224
2026-02-01,전체_월간,49,ABOUT TONE,スキンレイヤーフィットファンデーション,2495
2026-02-01,전체_월간,50,アビブ,"ハンドクリーム, 50ml",1863
2026-02-01,전체_월간,51,KATAN,"シカダーマヒットセラム5, 30g",3029
2026-02-01,전체_월간,52,manyo,"ガラクナイアシン3.0エッセンス, 30ml",2317
2026-02-01,전체_월간,53,ウェイクメイク,スパチュラワイドファンデーションブラシ,1498
2026-02-01,전체_월간,54,フィー,"3Dボリューミンググロス, 2個",2851
2026-02-01,전체_월간,55,リジュラン,PDRN化粧水＋クリームセット,11340
2026-02-01,전체_월간,56,インガ,パウダーブラーリップスティック,1693
2026-02-01,전체_월간,57,MARSHIQUE,セルフまつげパーマキット,2632
2026-02-01,전체_월간,58,コスノリ,"イージーブロウチェンジャー, 5回分",2245
2026-02-01,전체_월간,59,アミューズ,ジェルフィットグロス,1283
2026-02-01,전체_월간,60,Laka,"ラッピングクリーム, 50ml",2511
2026-02-01,전체_월간,61,BnD,"アンダーアームクリーム, 100g",3070
2026-02-01,전체_월간,62,BONCEPT,"ビタCフリーズドライダブルショットアンプルキット, 40ml",895
2026-02-01,전체_월간,63,ラネージュ,"リップスリーピングマスクEX, 20g",1915
2026-02-01,전체_월간,64,NAMING,デューアップハートリップグロス,1336
2026-02-01,전체_월간,65,メディキューブ,"ゼロ毛穴パッド 2.0, 70枚",1944
2026-02-01,전체_월간,66,アヌア,"3セラミドパンテノールモイスチャーバリアクリーム, 100ml",2268
2026-02-01,전체_월간,67,パパレシピ,"ブレミッシュバブル泥マスクパック, 140g",1855
2026-02-01,전체_월간,68,Mooekiss,ダブルエッセンスリップティント,1259
2026-02-01,전체_월간,69,hince,ロウグロウジェルティント,1524
2026-02-01,전체_월간,70,One-day's you,ダクトパッドセット,2027
2026-02-01,전체_월간,71,ホリカホリカ,マイフェイブピースシャドウ,729
2026-02-01,전체_월간,72,Redence,"トーン&スポットコレクターアンプル, 30ml",2077
2026-02-01,전체_월간,73,デイジーク,シャドウパレット,3078
2026-02-01,전체_월간,74,Kopher,"キュリペアSOSメルダーシステム, 1.5ml, 20本",4536
2026-02-01,전체_월간,75,MAYBELLINE NEW YORK,SPフラッフブロウムース,1672
2026-02-01,전체_월간,76,Pyt,ゲンバリップティント,1588
2026-02-01,전체_월간,77,セルフュージョンC,"コラーゲンPDRNアンプル, 35ml",2495
2026-02-01,전체_월간,78,manyo,"ピュアクレンジングオイル, 200ml",2049
2026-02-01,전체_월간,79,haruharu wonder,"ローズ PDRNスージングセラム, 30ml",2268
2026-02-01,전체_월간,80,バイオヒールボ,"プロバイオダーム3Dリフティングクリーム, 50ml, ",2551
2026-02-01,전체_월간,81,ルナ,コンシールブレンダーパレット,1903
2026-02-01,전체_월간,82,BEAUND,エンモードプロ,19281
2026-02-01,전체_월간,83,CHASIN’ RABBITS,"オールアバウトグロウカバークリーム, 35ml",1669
2026-02-01,전체_월간,84,ミルクタッチ,スプレッドフィットブラーティント,1595
2026-02-01,전체_월간,85,LUAFEE,"ホワイトアプリコット, 30ml",4844
2026-02-01,전체_월간,86,ジョリーアウアー,"ヤムトナー, 150ml",1071
2026-02-01,전체_월간,87,EYE2IN,セルフまつげパーマ9種10回分セット,2024
2026-02-01,전체_월간,88,オフラ,"ハイライター, ミニ",2940
2026-02-01,전체_월간,89,メディキューブ,"アゼライン酸ナイアシンアミドクリアトナー, 250ml",1863
2026-02-01,전체_월간,90,Laka,デビルリップ,1563
2026-02-01,전체_월간,91,TFIT,カバーアッププロコンシーラー,1288
2026-02-01,전체_월간,92,ロムアンド,ザジューシーラスティングティント,1069
2026-02-01,전체_월간,93,punbaki,"パーフェクトディープオフアンドスージングクレンジングオイル, 200ml",2308
2026-02-01,전체_월간,94,クリオ,プロアイパレットエアー,2422
2026-02-01,전체_월간,95,アヌア,"ライスブライトニング酵素洗顔パウダー, 40g",1579
2026-02-01,전체_월간,96,アテニア,"スキンクリアクレンズオイル - 無香, 175ml",1980
2026-02-01,전체_월간,97,ブラン,トラブルケア2種セット,5573
2026-02-01,전체_월간,98,コスノリ,ロングアクティブアイラッシュセラム,1458
2026-02-01,전체_월간,99,After blow,"パフュームハンドクリーム, 50ml",688
2026-02-01,전체_월간,100,D'AMU,ビタ5XピンクSET2,3208
2026-02-01,스킨케어_월간,1,アヌア,"ビタミン10PORESTRIXセラム, 20ml",2268
2026-02-01,스킨케어_월간,2,アヌア,"レチノール0.3ナイアシンリニューイングセラム, 30ml",2592
2026-02-01,스킨케어_월간,3,COSRX,"RXザアルファアルブチン2ニキビ跡ケアセラム, 50ml",1908
2026-02-01,스킨케어_월간,4,ブラン,"マジックティーツリーオイル, 20ml",2260
2026-02-01,스킨케어_월간,5,Redence,"リアルPDRNコラーゲンアンプル, 30ml",2531
2026-02-01,스킨케어_월간,6,AROCELL,"スーパーコラーゲンマスク, 4枚",2100
2026-02-01,스킨케어_월간,7,エイプリルスキン,"リアルカロテンIPMPブレミッシュセラムパックパッド, 80枚",2187
2026-02-01,스킨케어_월간,8,メディキューブ,"PDRNピンクペプチドアンプル, 30ml",2268
2026-02-01,스킨케어_월간,9,スキンアンドラブ,"グルタチオントナー, 200ml",2098
2026-02-01,스킨케어_월간,10,SKIN1004,"センテラアンプル, 55ml",1923
2026-02-01,스킨케어_월간,11,アヌア,"ナイアシンアミド10%ダークスポットセラム, 30ml",2268
2026-02-01,스킨케어_월간,12,celimax,"THEビタAレチナールショットタイトニングブースター, 15ml",2025
2026-02-01,스킨케어_월간,13,VTコスメティックス,"PDRNカプセルクリーム100, 50ml",1782
2026-02-01,스킨케어_월간,14,アヌア,"PDRNヒアルロン酸ハイドレイティングミスト, 100ml",2146
2026-02-01,스킨케어_월간,15,"dear,Klairs","PDRNビタペプチド毛穴リペアセラム, 35ml",2068
2026-02-01,스킨케어_월간,16,メディキューブ,"コウジ酸ビタナイアシントナー, 250ml",1863
2026-02-01,스킨케어_월간,17,パパレシピ,"リアルセンテラシカデイリークイッククーリングマスク, 30枚",2179
2026-02-01,스킨케어_월간,18,アヌア,"ドクダミポアコントロールクレンジングオイル, 200ml",1863
2026-02-01,스킨케어_월간,19,COSRX,"RXザビタミンC23セラム2世代, 20g",2171
2026-02-01,스킨케어_월간,20,ブラン,"マジックシカクリーム, 60ml",3880
2026-02-01,스킨케어_월간,21,ナンバーズイン,"5番 白玉グルタチオン100xTXA10集中トーニング美容液, 2個",3888
2026-02-01,스킨케어_월간,22,イズエンツリー,"超低分子ヒアルロン酸トナー, 300ml",1960
2026-02-01,스킨케어_월간,23,Kopher,"キュリペアメラクリーム, 35ml",2997
2026-02-01,스킨케어_월간,24,ジョリーアウアー,"ヤムヤムセラム, 50ml",1224
