일자,카테고리,순위,브랜드,상품명,가격
2026-01-19,베이스_주간,39,フィー,"クッショングラスオリジナル, 本品",2860
2026-01-19,베이스_주간,40,MAYBELLINE NEW YORK,"フィットミー リキッド ファンデーション R, 30ml",1792
2026-01-19,베이스_주간,41,ABOUT TONE,スキンレイヤーカバーフィットコンシーラー,1320
2026-01-19,베이스_주간,42,CHASIN’ RABBITS,"オールアバウトグロウトーンアップクリーム, 50ml",1863
2026-01-19,베이스_주간,43,トゥークールフォースクール,ヴェールドコントゥア,2490
2026-01-19,베이스_주간,44,glow,ノットドライコンシーラー,3630
2026-01-19,베이스_주간,45,AGE 20'S,ケアグロウハイライター「saki エディション」,1019
2026-01-19,베이스_주간,46,TFIT,"スキンカバーBB クリーム, 30g",1683
2026-01-19,베이스_주간,47,ティルティル,"マスクフィットレッドクッション, 本品",2970
2026-01-19,베이스_주간,48,クリオ,"キルカバーファンウェアクッション, 本品＋レフィル",3560
2026-01-19,베이스_주간,49,セルフュージョンC,"スキンブレミッシュバームインテンシブ, 30ml",2880
2026-01-19,베이스_주간,50,MAYBELLINE NEW YORK,SPステイ ルミマット リキッド ファンデーション,2992
2026-01-19,베이스_주간,51,hince,"カバーマスターピンククッション, 本品",2816
2026-01-19,베이스_주간,52,トゥークールフォースクール,アートクラスデュアルコントゥアスティック,1499
2026-01-19,베이스_주간,53,エスポア,ストロービングハイライター,2805
2026-01-19,베이스_주간,54,エイプリルスキン,トーンアップスキンティント,2364
2026-01-19,베이스_주간,55,Forencos,タトゥーウォータープルーフスカーコンシーラー,1650
2026-01-19,베이스_주간,56,ナンバーズイン,"3番 ノーファンデ陶器肌トーンアップクリーム, 50ml",2500
2026-01-19,베이스_주간,57,ABOUT TONE,"ウォーターレイヤーフィットクッション, 本品",3190
2026-01-19,베이스_주간,58,Funny Elves,ノートレースシースルーセッティングパウダー,2384
2026-01-19,베이스_주간,59,クリオ,"キルカバーハイグロウクッション, 本品+レフィル",3190
2026-01-19,베이스_주간,60,ブイディーエル,ローズPDRNプレップベース,3090
2026-01-19,베이스_주간,61,PERFECT DIARY,スターダストダイヤモンドハイライトパウダー,2990
2026-01-19,베이스_주간,62,ラネージュ,"ネオクッションミューイ, 本品",3520
2026-01-19,베이스_주간,63,ジョンセンムル,"エッセンシャルスキンヌーダーロングウェアクッション, 本品+レフィル",4950
2026-01-19,베이스_주간,64,ブイディーエル,"カバーステインパーフェクティングファンデーション, 30ml",3530
2026-01-19,베이스_주간,65,ティルティル,シルエットコントゥアスティック,1760
2026-01-19,베이스_주간,66,ティルティル,"マスクフィットAIフィルタークッション, ミニ, 本品",2970
2026-01-19,베이스_주간,67,オフラ,ハイライター,6160
2026-01-19,베이스_주간,68,タッチインソル,ノーポアブレムミネラルパウダー,685
2026-01-19,베이스_주간,69,ティルティル,"マスクフィットトーンアップクリーム, 50ml",2420
2026-01-19,베이스_주간,70,アンジエンド,ピンクプライマー,2680
2026-01-19,베이스_주간,71,NAMING,"レイヤードフィットクッション, 本品",2900
2026-01-19,베이스_주간,72,タッチインソル,スキンカバークッション ,2450
2026-01-19,베이스_주간,73,Funny Elves,ロングウェアファンデーション,999
2026-01-19,베이스_주간,74,HARIAS,"クッションファンデーション, レフィル",3280
2026-01-19,베이스_주간,75,エチュード,コントゥアスティック,1400
2026-01-19,베이스_주간,76,Ririmew,"トーンアップカラープライマー, 30ml",1760
2026-01-19,베이스_주간,77,タッチインソル,プリティフィルターインマイハートスティックファンデーション,2310
2026-01-19,베이스_주간,78,ブイディーエル,"トーンステインカラーコレクティングプライマー, 13ml, 2個",3320
2026-01-19,베이스_주간,79,ウェイクメイク,ディファイニングカバーコンシーラー,1490
2026-01-19,베이스_주간,80,ティルティル,"マスクフィットレッドファンデーション, 30ml",2970
2026-01-19,베이스_주간,81,ジョンセンムル,"スキンヌーダーカバーレイヤークッション, 本品+レフィル",4950
2026-01-19,베이스_주간,82,MilleFée,チート顔コントゥアパレット,2390
2026-01-19,베이스_주간,83,NUDIQUE,"シアーグロウベース, 35ml",3200
2026-01-19,베이스_주간,84,デイジーク,"ウォーターベールプライマー, 40ml",2800
2026-01-19,베이스_주간,85,ティルティル,マスクフィットオールカバーデュアルコンシーラー,1815
2026-01-19,베이스_주간,86,ラネージュ,"ネオクッション, 本品",3300
2026-01-19,베이스_주간,87,BeginS,"ポアケアリングメッシュクッション, 本品",3300
2026-01-19,베이스_주간,88,ブイディーエル,"カバーステインパーフェクティングファンデーション, 30ml",3630
2026-01-19,베이스_주간,89,ミュード,フェイスフィルボリューマーハイライト,2090
2026-01-19,베이스_주간,90,ウェイクメイク,"シームレスウェアクッション, 本品+レフィル",2890
2026-01-19,베이스_주간,91,TFIT,"ルミネアスキップトーンアップクリーム, 100g",1790
2026-01-19,베이스_주간,92,ByUR,セラムフィットスキニーグロウリキッドファンデーション,3410
2026-01-19,베이스_주간,93,23yearsold,ハートリーフシンカバークッション,2380
2026-01-19,베이스_주간,94,SPICARE,"V3 エキサイティングファンデーション, レフィル",7700
2026-01-19,베이스_주간,95,ティルティル,"マスクフィットオールカバークッション, 本品",2970
2026-01-19,베이스_주간,96,タッチインソル,"ノーポアブレムレッドネスコレクティングベース, 30ml",1594
2026-01-19,베이스_주간,97,シピシピ,フィットスキンクッション,2750
2026-01-19,베이스_주간,98,ウェイクメイク,ミックスブラーリングボリュームシェーディング,1530
2026-01-19,베이스_주간,99,SPICARE,"V3ブリリアントファンデーション, 本品",9350
2026-01-19,베이스_주간,100,タッチインソル,"プリティフィルターアイシーシャーベットプライマー, 30g",1521
2026-01-19,포인트_주간,1,ロムアンド,ハンオールブロウカラ,1210
2026-01-19,포인트_주간,2,2ªN,ベターミーアイパレット,2200
2026-01-19,포인트_주간,3,NAMING,オーバーデューグロッシーリップティント,1760
2026-01-19,포인트_주간,4,トゥークールフォースクール,プロタージュペンシル,1380
2026-01-19,포인트_주간,5,2ªN,デュアルチーク,1870
2026-01-19,포인트_주간,6,AZTK,ジェリーカラーチークリキッド,1290
2026-01-19,포인트_주간,7,ENTROPY MAKEUP,チュールグロス,4000
2026-01-19,포인트_주간,8,AOU,ブレンディングリップペンシル,1599
2026-01-19,포인트_주간,9,エイプリルスキン,ヒーローリップタトゥーティント,1950
2026-01-19,포인트_주간,10,Laka,スージングプレップリップマスク,1930
2026-01-19,포인트_주간,11,soaddicted,アイラッシュコンディショニングセラム アドバンス,11000
2026-01-19,포인트_주간,12,インガ,ウォーターダブルラスティングセンティッドティント,3380
2026-01-19,포인트_주간,13,トゥークールフォースクール,アートクラススマッジングアンダーライナー,1399
2026-01-19,포인트_주간,14,デイジーク,プロスリムブロウカラ,1200
2026-01-19,포인트_주간,15,カラーグラム,ギークヌードカラーカバーティント,1100
2026-01-19,포인트_주간,16,フィー,"3Dボリューミンググロス, 2個",3100
2026-01-19,포인트_주간,17,MARSHIQUE,セルフまつげパーマキット,3250
2026-01-19,포인트_주간,18,ミルクタッチ,ジェリーフィットティンティッドグロウティント,1760
2026-01-19,포인트_주간,19,Laka,フルーティーグラムティント,1960
2026-01-19,포인트_주간,20,FEG,FEGまつ毛美容液,999
2026-01-19,포인트_주간,21,MAYBELLINE NEW YORK,SPフラッフブロウムース,1672
2026-01-19,포인트_주간,22,デイジーク,プロディテールブロウペンシル,1400
2026-01-19,포인트_주간,23,Mooekiss,ダブルエッセンスリップティント,1760
2026-01-19,포인트_주간,24,AGE 20'S,ベルベットヘーズブラッシャー,1823
2026-01-19,포인트_주간,25,Pyt,ゲンバリップティント,1980
2026-01-19,포인트_주간,26,Laka,デビルリップ,1930
2026-01-19,포인트_주간,27,コスノリ,"イージーブロウチェンジャー, 5回分",2860
2026-01-19,포인트_주간,28,クリオ,プロアイパレットエアー,2990
2026-01-19,포인트_주간,29,ロムアンド,ザジューシーラスティングティント,1320
2026-01-19,포인트_주간,30,コスノリ,ロングアクティブアイラッシュセラム,1870
2026-01-19,포인트_주간,31,EYE2IN,セルフまつげパーマ9種10回分セット,2499
2026-01-19,포인트_주간,32,ミルクタッチ,スプレッドフィットブラーティント,1969
2026-01-19,포인트_주간,33,デイジーク,シャドウパレット,3800
2026-01-19,포인트_주간,34,ウェイクメイク,ソフトブラーリングアイパレット,2790
2026-01-19,포인트_주간,35,qruam,アイチューニングライナー,1386
2026-01-19,포인트_주간,36,NAMING,フラッフィーパウダーブラッシュ,1650
2026-01-19,포인트_주간,37,ホリカホリカ,マイフェイブピースシャドウ,900
2026-01-19,포인트_주간,38,ミルクタッチ,アイコニックマスカラ,1628
2026-01-19,포인트_주간,39,EYE2IN,セルフまつげパーマ5回分トライアルキット,1799
2026-01-19,포인트_주간,40,SISTER ANN,ウォータープルーフペンシルアイライナー,1290
2026-01-19,포인트_주간,41,Laka,マキシグレイヤーティント,1930
2026-01-19,포인트_주간,42,ロムアンド,グラスティングカラーグロス,1320
2026-01-19,포인트_주간,43,ペリペラ,ピュアブラッシュドサンシャインチーク,780
2026-01-19,포인트_주간,44,アミューズ,バナナリップオイル,1405
2026-01-19,포인트_주간,45,ペリペラ,インクグラスティングリップグロス,1390
2026-01-19,포인트_주간,46,LUMMIR,ライトオンアイズシャドウパレット,3300
2026-01-19,포인트_주간,47,デイジーク,ブレンディングムードチーク,2490
2026-01-19,포인트_주간,48,アミューズ,ジェルフィットグロス,1584
2026-01-19,포인트_주간,49,ペリペラ,シロッピートックチーク,1390
2026-01-19,포인트_주간,50,ハートパーセント,ドットオンムードリップペンシル,1489
2026-01-19,포인트_주간,51,クリオ,ベルベットリップライナー,1400
2026-01-19,포인트_주간,52,マージー,ダブルグレーズロックティント,1780
2026-01-19,포인트_주간,53,Laka,ボンディンググロウリップスティック,2060
2026-01-19,포인트_주간,54,ラネージュ,リップグロウィバーム,1870
2026-01-19,포인트_주간,55,EITHER&,デューイシロップティント,1633
2026-01-19,포인트_주간,56,ブイディーエル,チークステインブラッシャー,2210
2026-01-19,포인트_주간,57,カラーグラム,ヌーディーブラーティント,1190
2026-01-19,포인트_주간,58,AOU,ソフトクリームチーク,2050
2026-01-19,포인트_주간,59,ジョンセンムル,アーティストクッションブラッシュ,2400
2026-01-19,포인트_주간,60,Dinto,ブラーグロウイリップティント,1870
2026-01-19,포인트_주간,61,ミュード,インスパイアスキニーブロウカラ,1400
2026-01-19,포인트_주간,62,SISTER ANN,"ウォータープルーフペンシルアイライナー, 2個",1980
2026-01-19,포인트_주간,63,エスポア,クチュールリップティントグレイズ,1993
2026-01-19,포인트_주간,64,ペリペラ,スピーディースキニーブロウ,580
2026-01-19,포인트_주간,65,ペリペラ,ピュアブラッシュドサンシャインチーク,784
2026-01-19,포인트_주간,66,ティルティル,ウォーターリズムグロウティント,1650
2026-01-19,포인트_주간,67,BBIA,レディトゥウェアアイパレット,1600
2026-01-19,포인트_주간,68,BBIA,グロウリップティント,1500
2026-01-19,포인트_주간,69,JUDYDOLL,わがままチークハイライター,1870
2026-01-19,포인트_주간,70,ロムアンド,ベターザンパレット,3100
2026-01-19,포인트_주간,71,VIDIVICI,ペプチドバターティントバーム,2000
2026-01-19,포인트_주간,72,ペリペラ,インクグラスティングリップグロス,1190
2026-01-19,포인트_주간,73,ウェイクメイク,ヘルシーグロウバームスティック,1450
2026-01-19,포인트_주간,74,フィー,"3Dボリューミングティント, 2個",3100
2026-01-19,포인트_주간,75,シピシピ,デューイフィルムティントR,1430
2026-01-19,포인트_주간,76,クリオ,クリスタルグラムバーム,1700
2026-01-19,포인트_주간,77,リリーバイレッド,ラブビームチークバーム,1320
2026-01-19,포인트_주간,78,LoNLy,キャンドルライトジュレティント,1945
2026-01-19,포인트_주간,79,AOU,グロウイティントバーム,1990
2026-01-19,포인트_주간,80,Pyt,ゲンバリキッドチーク,1980
2026-01-19,포인트_주간,81,アンジエンド,アイパワーセラム,2680
2026-01-19,포인트_주간,82,コスノリ,"セルフまつ毛パーマキット, 5回分",2970
2026-01-19,포인트_주간,83,ミュード,インスパイアスキニーマスカラ&マルチフィクサー,1500
2026-01-19,포인트_주간,84,ICLIONE,"セルフまつげパーマ, 10回分",2350
2026-01-19,포인트_주간,85,ラネージュ,グレイズティントリップセラム,3960
2026-01-19,포인트_주간,86,コスノリ,アイラッシュコーティングセラム,1650
2026-01-19,포인트_주간,87,AOU,マットバー,1700
2026-01-19,포인트_주간,88,エスポア,ザブロウバランスペンシル,1726
2026-01-19,포인트_주간,89,フィー,メロウデュアルチーク,2090
2026-01-19,포인트_주간,90,インガ,ウォーターグロウリップティント,1690
2026-01-19,포인트_주간,91,デイジーク,ムードシャドウパレット,4490
2026-01-19,포인트_주간,92,2ªN,カラープレイデュアルライナー,1430
2026-01-19,포인트_주간,93,SISTER ANN,パーフェクトスリムアイペンシル,1100
2026-01-19,포인트_주간,94,ミュード,インスパイアカーリングマスカラ,1900
2026-01-19,포인트_주간,95,ペリペラ,インクムードグロイティント,1091
2026-01-19,포인트_주간,96,MilleFée,シェイクドロップチーク,1950
2026-01-19,포인트_주간,97,AGE 20'S,ケアグロウリップバーム「saki エディション」,999
2026-01-19,포인트_주간,98,カラーグラム,タンフルグラスティントミルク,1190
2026-01-19,포인트_주간,99,ロムアンド,ハンオールフラットブロウ,1300
2026-01-19,포인트_주간,100,エスポア,ノーウェアリップスティックバーミンググロウ,2244
2026-01-26,전체_주간,1,VTコスメティックス,PDRNリードルショットブラシヘアセラム,1980
2026-01-26,전체_주간,2,アヌア,"ビタミン10PORESTRIXセラム, 20ml",2800
2026-01-26,전체_주간,3,23yearsold,ダーマシンコンシーラー,1580
2026-01-26,전체_주간,4,アヌア,"PDRNヒアルロン酸カプセル100セラム, 30ml",3200
2026-01-26,전체_주간,5,アヌア,"レチノール0.3ナイアシンリニューイングセラム, 30ml",3200
2026-01-26,전체_주간,6,メディキューブ,ブースタープロ,32000
2026-01-26,전체_주간,7,COSRX,"RXザアルファアルブチン2ニキビ跡ケアセラム, 50ml",2356
2026-01-26,전체_주간,8,ロムアンド,ハンオールブロウカラ,1210
2026-01-26,전체_주간,9,エイプリルスキン,"ヒーロークッション, 本品+レフィル",3700
2026-01-26,전체_주간,10,アビブ,"ハンドクリーム, 50ml",2300
2026-01-26,전체_주간,11,MilleFée,ちいかわメイクパフコンプリートボックス,4350
2026-01-26,전체_주간,12,ブラン,"マジックティーツリーオイル, 20ml",2790
2026-01-26,전체_주간,13,セルフュージョンC,"レーザーリジュベネーションクリーム, 50ml",3080
2026-01-26,전체_주간,14,NAMING,デューアップハートリップグロス,1650
2026-01-26,전체_주간,15,celimax,"THEビタAレチナールショットタイトニングブースター, 15ml",2500
2026-01-26,전체_주간,16,エイプリルスキン,"リアルカロテンIPMPブレミッシュセラムパックパッド, 80枚",2700
2026-01-26,전체_주간,17,Redence,"リアルPDRNコラーゲンアンプル, 30ml",2880
2026-01-26,전체_주간,18,カラーグラム,ギークヌードカラーカバーティント,1190
2026-01-26,전체_주간,19,エイプリルスキン,ヒーローリップタトゥーティント,1950
2026-01-26,전체_주간,20,SKIN1004,"センテラアンプル, 55ml",2375
2026-01-26,전체_주간,21,メディキューブ,"PDRNピンクペプチドアンプル, 30ml",2800
2026-01-26,전체_주간,22,Laka,フルーティーグラムティント,1960
2026-01-26,전체_주간,23,アヌア,"ナイアシンアミド10%ダークスポットセラム, 30ml",2800
2026-01-26,전체_주간,24,2ªN,デュアルチーク,1870
2026-01-26,전체_주간,25,トゥークールフォースクール,プロタージュペンシル,1349
2026-01-26,전체_주간,26,NAMING,オーバーデューグロッシーリップティント,1760
2026-01-26,전체_주간,27,パパレシピ,"リアルセンテラシカデイリークイッククーリングマスク, 30枚",1221
2026-01-26,전체_주간,28,スキンアンドラブ,"グルタチオントナー, 200ml",2590
2026-01-26,전체_주간,29,パパレシピ,"ブレミッシュバブル泥マスクパック, 140g",1221
2026-01-26,전체_주간,30,パティオン,"ノスカナイントラブルセラム, 30ml",3000
2026-01-26,전체_주간,31,トリデン,"ダイブインセラム, 80ml",2850
2026-01-26,전체_주간,32,AZTK,ジェリーカラーチークリキッド,1290
2026-01-26,전체_주간,33,lily eve,"グロウターンアンプル, 100ml, 2個",5600
2026-01-26,전체_주간,34,アミューズ,ジェルフィットグロス,1584
2026-01-26,전체_주간,35,TFIT,トランスルーセントセットフィニッシングパウダー,1690
2026-01-26,전체_주간,36,アヌア,"PDRNヒアルロン酸ハイドレイティングミスト, 100ml",2650
2026-01-26,전체_주간,37,COSRX,"RXザビタミンC23セラム2世代, 20g",2546
2026-01-26,전체_주간,38,アヌア,"ドクダミポアコントロールクレンジングオイル, 200ml",2300
2026-01-26,전체_주간,39,ABOUT TONE,"スキンレイヤーフィットファンデーション, 3ml",350
2026-01-26,전체_주간,40,ブラン,"マジックシカクリーム, 60ml",4790
2026-01-26,전체_주간,41,ブラン,"皮脂ゼロエアフィットクッション, 本品",2980
2026-01-26,전체_주간,42,インガ,パウダーブラーリップスティック,890
2026-01-26,전체_주간,43,shaishaishai,サンキスドプランプリップバーム,1650
2026-01-26,전체_주간,44,イズエンツリー,"超低分子ヒアルロン酸トナー, 300ml",2385
2026-01-26,전체_주간,45,JUDYDOLL,メリハリマスターパレット,2090
2026-01-26,전체_주간,46,D'AMU,ビタ5XピンクSET2,3960
2026-01-26,전체_주간,47,アヌア,"3セラミドパンテノールモイスチャーバリアクリーム, 100ml",2800
2026-01-26,전체_주간,48,ナンバーズイン,"5番 白玉グルタチオン100xTXA10集中トーニング美容液, 2個",4800
2026-01-26,전체_주간,49,KATAN,"シカダーマヒットセラム5, 30g",3740
2026-01-26,전체_주간,50,MAYBELLINE NEW YORK,SPフラッフブロウムース,1672
2026-01-26,전체_주간,51,soaddicted,アイラッシュコンディショニングセラム アドバンス,11000
2026-01-26,전체_주간,52,BnD,"アンダーアームクリーム, 100g",3790
2026-01-26,전체_주간,53,メディキューブ,"コウジ酸ビタナイアシントナー, 250ml",2300
2026-01-26,전체_주간,54,メディキューブ,"ゼロ毛穴パッド 2.0, 70枚",2400
2026-01-26,전체_주간,55,アイソイ,"インテンシブリフティングアンプルスティック, 15ml",1500
2026-01-26,전체_주간,56,BRMUD,"リカバリーマッドパックツーフォームクレンザー, 110ml",1500
2026-01-26,전체_주간,57,AOU,ブレンディングリップペンシル,1599
2026-01-26,전체_주간,58,Kopher,"キュリペアメラクリーム, 35ml",3700
2026-01-26,전체_주간,59,フィー,"3Dボリューミンググロス, 2個",3520
2026-01-26,전체_주간,60,デイジーク,シャドウパレット,3800
2026-01-26,전체_주간,61,バイオヒールボ,"プロバイオダーム3Dリフティングクリーム, 50ml, ",3150
2026-01-26,전체_주간,62,ミルクタッチ,ジェリーフィットティンティッドグロウティント,1760
2026-01-26,전체_주간,63,MARSHIQUE,セルフまつげパーマキット,3250
2026-01-26,전체_주간,64,ByUR,セラムフィットルースフェイスパウダー,2090
2026-01-26,전체_주간,65,After blow,"パフュームハンドクリーム, 50ml",850
2026-01-26,전체_주간,66,バイオヒールボ,"プロバイオダーム3Dリフティングクリーム, 50ml, 本品+レフィル",5490
2026-01-26,전체_주간,67,FEG,FEGまつ毛美容液,799
2026-01-26,전체_주간,68,ウェイクメイク,スパチュラワイドファンデーションブラシ,1850
2026-01-26,전체_주간,69,Mooekiss,ダブルエッセンスリップティント,1760
2026-01-26,전체_주간,70,ABOUT TONE,スキンレイヤーフィットファンデーション,3080
2026-01-26,전체_주간,71,JUL7ME,"パフュームグロウミルクヘアエッセンス, 80ml",1804
2026-01-26,전체_주간,72,BRMUD,"ディープメルティングポアクレンジングオイル, 200ml",2990
2026-01-26,전체_주간,73,Laka,"ラッピングクリーム, 50ml",3100
2026-01-26,전체_주간,74,One-day's you,ダクトパッドセット,2750
2026-01-26,전체_주간,75,コスノリ,"イージーブロウチェンジャー, 5回分",2860
2026-01-26,전체_주간,76,Laka,スージングプレップリップマスク,1930
2026-01-26,전체_주간,77,ルナ,コンシールブレンダーパレット,2350
2026-01-26,전체_주간,78,メディキューブ,"アゼライン酸ナイアシンアミドクリアトナー, 250ml",2300
2026-01-26,전체_주간,79,EYE2IN,セルフまつげパーマ9種10回分セット,2499
2026-01-26,전체_주간,80,Pyt,ゲンバリップティント,1980
2026-01-26,전체_주간,81,Kopher,"キュリペアSOSメルダーシステム, 1.5ml, 20本",5600
2026-01-26,전체_주간,82,COSRX,"RXザ6ペプチドスキンブースターセラム, 150ml",2356
2026-01-26,전체_주간,83,manyo,"ガラクナイアシン3.0エッセンス, 30ml",2860
2026-01-26,전체_주간,84,クリオ,プロアイパレットエアー,2990
2026-01-26,전체_주간,85,ブイディーエル,"トーンステインカラーコレクティングプライマー, 30ml",3080
2026-01-26,전체_주간,86,メディキューブ,"コウジ酸ビタピールショット, 80ml",2400
2026-01-26,전체_주간,87,SKIN1004,"センテラクイックカーミングパッド, 70枚",3135
2026-01-26,전체_주간,88,Lepique,"レチノールナイトクリーム, 50ml",2849
2026-01-26,전체_주간,89,アテニア,"スキンクリアクレンズオイル - 無香, 175ml",1980
2026-01-26,전체_주간,90,コスノリ,ロングアクティブアイラッシュセラム,1870
2026-01-26,전체_주간,91,ノエット,"ベアシンスティック, 2個",2957
2026-01-26,전체_주간,92,トリデン,"セルメイジングビタCアンプル, 30ml",1980
2026-01-26,전체_주간,93,ジョンセンムル,"エッセンシャルスキンヌーダークッション, 本品",3440
2026-01-26,전체_주간,94,ロムアンド,ザジューシーラスティングティント,1320
2026-01-26,전체_주간,95,Kundal,プレミアムヘアケアスペシャルセット,2970
2026-01-26,전체_주간,96,narka,"ストレートスリックヘアミルク, 150ml",1492
2026-01-26,전체_주간,97,LUMMIR,ライトオンアイズシャドウパレット,3300
2026-01-26,전체_주간,98,NAMING,フラッフィーパウダーブラッシュ,1650
2026-01-26,전체_주간,99,TFIT,カバーアッププロコンシーラー,1590
2026-01-26,전체_주간,100,スキンアンドラブ,ケアベアコラボ新年一押しセット,5890
2026-01-26,스킨케어_주간,1,アヌア,"ビタミン10PORESTRIXセラム, 20ml",2800
2026-01-26,스킨케어_주간,2,アヌア,"PDRNヒアルロン酸カプセル100セラム, 30ml",3200
2026-01-26,스킨케어_주간,3,アヌア,"レチノール0.3ナイアシンリニューイングセラム, 30ml",3200
2026-01-26,스킨케어_주간,4,COSRX,"RXザアルファアルブチン2ニキビ跡ケアセラム, 50ml",2356
