일자,카테고리,순위,브랜드,상품명,가격
2026-02-01,스킨케어_월간,25,KATAN,"シカダーマヒットセラム5, 30g",3029
2026-02-01,스킨케어_월간,26,manyo,"ガラクナイアシン3.0エッセンス, 30ml",2317
2026-02-01,스킨케어_월간,27,Laka,"ラッピングクリーム, 50ml",2511
2026-02-01,스킨케어_월간,28,BONCEPT,"ビタCフリーズドライダブルショットアンプルキット, 40ml",895
2026-02-01,스킨케어_월간,29,メディキューブ,"ゼロ毛穴パッド 2.0, 70枚",1944
2026-02-01,스킨케어_월간,30,アヌア,"3セラミドパンテノールモイスチャーバリアクリーム, 100ml",2268
2026-02-01,스킨케어_월간,31,パパレシピ,"ブレミッシュバブル泥マスクパック, 140g",1855
2026-02-01,스킨케어_월간,32,One-day's you,ダクトパッドセット,2027
2026-02-01,스킨케어_월간,33,Redence,"トーン&スポットコレクターアンプル, 30ml",2077
2026-02-01,스킨케어_월간,34,Kopher,"キュリペアSOSメルダーシステム, 1.5ml, 20本",4536
2026-02-01,스킨케어_월간,35,セルフュージョンC,"コラーゲンPDRNアンプル, 35ml",2495
2026-02-01,스킨케어_월간,36,manyo,"ピュアクレンジングオイル, 200ml",2049
2026-02-01,스킨케어_월간,37,haruharu wonder,"ローズ PDRNスージングセラム, 30ml",2268
2026-02-01,스킨케어_월간,38,バイオヒールボ,"プロバイオダーム3Dリフティングクリーム, 50ml, ",2551
2026-02-01,스킨케어_월간,39,ジョリーアウアー,"ヤムトナー, 150ml",1071
2026-02-01,스킨케어_월간,40,メディキューブ,"アゼライン酸ナイアシンアミドクリアトナー, 250ml",1863
2026-02-01,스킨케어_월간,41,punbaki,"パーフェクトディープオフアンドスージングクレンジングオイル, 200ml",2308
2026-02-01,스킨케어_월간,42,アヌア,"ライスブライトニング酵素洗顔パウダー, 40g",1579
2026-02-01,스킨케어_월간,43,アテニア,"スキンクリアクレンズオイル - 無香, 175ml",1980
2026-02-01,스킨케어_월간,44,SKIN1004,"センテラクイックカーミングパッド, 70枚",2539
2026-02-01,스킨케어_월간,45,ジョリーアウアー,"マイルドオイルフォームクレンジング, 150ml",1224
2026-02-01,스킨케어_월간,46,COSRX,"RXザ6ペプチドスキンブースターセラム, 150ml",1908
2026-02-01,스킨케어_월간,47,AESTURA,"アトバリア365クリームミスト, 120ml",2025
2026-02-01,스킨케어_월간,48,KISOCARE,"ハイドロクリームPHQ-8, 20g",1949
2026-02-01,스킨케어_월간,49,セラディックス,131パッケージセット,2916
2026-02-01,스킨케어_월간,50,ウェルダーマ,"ティーツリースージングハーブトックスピーリングパック, 150g, シリコンブラシ付き",1750
2026-02-01,스킨케어_월간,51,トゥヴェール,"ナノエマルジョンディープ, 60ml",2924
2026-02-01,스킨케어_월간,52,オーズナリー,"ビタ３セラム, 50ml",2308
2026-02-01,스킨케어_월간,53,AOU,"トーンアップぽよんクリーム, 100ml",1612
2026-02-01,스킨케어_월간,54,punbaki,"ローズヒップモイスチャライジング インテンシブ クリーム, 50ml",3028
2026-02-01,스킨케어_월간,55,スキンアンドラブ,"レチノールリペアセラム, 30ml",2179
2026-02-01,스킨케어_월간,56,アイソイ,"インテンシブリフティングアンプルスティック, 15ml",1215
2026-02-01,스킨케어_월간,57,ラロッシュポゼ,"シカプラストリペアクリームB5+, 40ml",2899
2026-02-01,스킨케어_월간,58,Lepique,"レチノールナイトクリーム, 50ml",3297
2026-02-01,스킨케어_월간,59,トリデン,"セルメイジングビタCアンプル, 30ml",1901
2026-02-01,스킨케어_월간,60,SKIN1004,"プロバイオシカインテンシブアンプル, 50ml",2385
2026-02-01,스킨케어_월간,61,KATAN,"シカダーマヒットセラム10, 30g",4633
2026-02-01,스킨케어_월간,62,COSRX,"フルフィットプロポリスシナジートナー, 150ml",1453
2026-02-01,스킨케어_월간,63,メディヒール,"ホワイトミルクブライトニングトナー, 300ml",2095
2026-02-01,스킨케어_월간,64,パパレシピ,"リアルセンテラシカカーミングセラム, 30ml",989
2026-02-01,스킨케어_월간,65,スキンアンドラブ,"TXナイアシンエッセンストナー, 200ml",2098
2026-02-01,스킨케어_월간,66,ODELOI,"弱酸性毛穴収縮ニドソープ, 120g",1592
2026-02-01,스킨케어_월간,67,ナンバーズイン,"5番 白玉グルタチオンＣ美容液, 30ml",2430
2026-02-01,스킨케어_월간,68,UIQ,"バイオームバリアパンテンシブクリーム, 50ml, 2個",3864
2026-02-01,스킨케어_월간,69,ラゴム,"ジェルトゥウォータークレンザー [朝洗顔], 220ml",1871
2026-02-01,스킨케어_월간,70,パティオン,"ノスカナイントラブルセラム, 30ml",2430
2026-02-01,스킨케어_월간,71,AHC,"プロショットコラジュビネーションリフト4イントラセラム, 40ml",2884
2026-02-01,스킨케어_월간,72,Kopher,"キュリペアダーマアンプル, 100ml",3888
2026-02-01,스킨케어_월간,73,lily eve,"セルターンクリーム, 100ml",2754
2026-02-01,스킨케어_월간,74,アヌア,"PDRNヒアルロン酸100モイスチャライジングクリーム, 60ml",2592
2026-02-01,스킨케어_월간,75,AROCELL,"メラTXAマスク, 12枚",6019
2026-02-01,스킨케어_월간,76,BRMUD,"リカバリーマッドパックツーフォームクレンザー, 110ml",1215
2026-02-01,스킨케어_월간,77,Derma Factory,"トラネキサム酸6%クリーム, 30ml, 2個",1993
2026-02-01,스킨케어_월간,78,ブラン,"マジックティーツリーオイル, 20ml, 2個",4066
2026-02-01,스킨케어_월간,79,原料工房,"アズレンスーディングコラーゲンゲルマスク, 5枚",2106
2026-02-01,스킨케어_월간,80,Sung Boon Editor,"シルクペプチドEGFハートフィットボリュームアンプル, 40ml",2349
2026-02-01,스킨케어_월간,81,SKIN1004,"センテラライトクレンジングオイル, 200ml",2001
2026-02-01,스킨케어_월간,82,LUVUM,"スローエイジングスーパーフードオイル, 30ml",3078
2026-02-01,스킨케어_월간,83,celimax,"ノニエネルギーアンプル, 30ml",2106
2026-02-01,스킨케어_월간,84,ダルバ,"ホワイトトリュフファーストスプレーセラム, 100ml",2700
2026-02-01,스킨케어_월간,85,センテリアン24,"エキスパートマデカクリームリニューPDRN, 50ml",2317
2026-02-01,스킨케어_월간,86,セラディックス,"ビタKダーククリア アイクリーム, 15ml",1863
2026-02-01,스킨케어_월간,87,イージーデュー,"DW-EGFメラトーニングワンデイアンプル, 10ml",1993
2026-02-01,스킨케어_월간,88,KITEN,"レチノールシカクリーム, 20g",2414
2026-02-01,스킨케어_월간,89,BRMUD,"ディープメルティングポアクレンジングオイル, 200ml",2422
2026-02-01,스킨케어_월간,90,メディキューブ,"アゼライン酸16BBカーミングセラム, 30ml",2268
2026-02-01,스킨케어_월간,91,バイオヒールボ,"プロバイオダーム3Dリフティングアイ＆リンクルクリーム, 25ml, 2個",2227
2026-02-01,스킨케어_월간,92,バイオヒールボ,"プロバイオダームコラーゲンリモデリングクリーム, 50ml",2260
2026-02-01,스킨케어_월간,93,ODELOI,"ブラックチェリー毛穴収縮クリームルフティグ, 100ml",1867
2026-02-01,스킨케어_월간,94,Lepique,"コラーゲンシートマスク, 4枚",2342
2026-02-01,스킨케어_월간,95,ドクタージー,"レッドブレミッシュクリアスージングクリーム, 70ml",2319
2026-02-01,스킨케어_월간,96,アレンシア,"PDRNもちクレジングバーム, 90g, 4個",3969
2026-02-01,스킨케어_월간,97,ダルバ,"オールデイセラムメイクアップフィクサー, 80ml",2592
2026-02-01,스킨케어_월간,98,ブラン,"マジックシカクリーム, 60ml, 2個",6982
2026-02-01,스킨케어_월간,99,アヌア,"ドクダミセンテラレッドスポットクリーム, 30g",1782
2026-02-01,스킨케어_월간,100,Sung Boon Editor,"グリーントマトNMNポアリフティングアンプル, 40ml",2349
2026-02-01,베이스_월간,1,23yearsold,ダーマシンコンシーラー,1280
2026-02-01,베이스_월간,2,エイプリルスキン,"ヒーロークッション, 本品+レフィル",2997
2026-02-01,베이스_월간,3,ABOUT TONE,"スキンレイヤーフィットファンデーション, 3ml",350
2026-02-01,베이스_월간,4,ブラン,"皮脂ゼロエアフィットクッション, 本品",2414
2026-02-01,베이스_월간,5,TFIT,トランスルーセントセットフィニッシングパウダー,1369
2026-02-01,베이스_월간,6,JUDYDOLL,メリハリマスターパレット,1448
2026-02-01,베이스_월간,7,ABOUT TONE,スキンレイヤーフィットファンデーション,2495
2026-02-01,베이스_월간,8,CHASIN’ RABBITS,"オールアバウトグロウカバークリーム, 35ml",1669
2026-02-01,베이스_월간,9,オフラ,"ハイライター, ミニ",2940
2026-02-01,베이스_월간,10,TFIT,カバーアッププロコンシーラー,1288
2026-02-01,베이스_월간,11,ジョンセンムル,"エッセンシャルスキンヌーダークッション, 本品",2786
2026-02-01,베이스_월간,12,アイムミミ,アイムマルチスティックデュアル,1291
2026-02-01,베이스_월간,13,ブイディーエル,"トーンステインカラーコレクティングプライマー, 30ml",2495
2026-02-01,베이스_월간,14,タッチインソル,"ノーポアブレムプライマー, 30ml",1844
2026-02-01,베이스_월간,15,ウェイクメイク,"シームレスウェアファンデーション, 30ml, スパチュラブラシ付き",2616
2026-02-01,베이스_월간,16,glow,"ブリーザブルBBクリーム, 30ml",2827
2026-02-01,베이스_월간,17,PERFECT DIARY,エッセンスコンシーリング UV クッションファンデーション,1833
2026-02-01,베이스_월간,18,2ªN,ピュアグラッシュハイライター,1158
2026-02-01,베이스_월간,19,Funny Elves,ソフトマットプレストパウダー,1979
2026-02-01,베이스_월간,20,AGE 20'S,"シグネチャーエッセンスパクト, 本品+レフィル",3406
2026-02-01,베이스_월간,21,スキンフード,サーモンダークサークルコンシーラークリーム,891
2026-02-01,베이스_월간,22,ナンバーズイン,5番 白玉グルタチオンＣトーンアップベース,2349
2026-02-01,베이스_월간,23,エイプリルスキン,"マジックスノークッション, 本品+レフィル",2997
2026-02-01,베이스_월간,24,GIVERNY,"密着カバーファンデーション, ブラシ",2365
2026-02-01,베이스_월간,25,MAYBELLINE NEW YORK,"フィットミー リキッド ファンデーション R, 30ml",1650
2026-02-01,베이스_월간,26,ウェイクメイク,"ウォーターグロウコーティングバーム, 本品+レフィル",2341
2026-02-01,베이스_월간,27,ダルバ,"グロウフィットセラムカバークッション, 本品",2349
2026-02-01,베이스_월간,28,ラネージュ,"ネオクッションミューイ, 本品",2851
2026-02-01,베이스_월간,29,TFIT,アイドルカバーコンシーラー,1141
2026-02-01,베이스_월간,30,AGE 20'S,ビタシースキンケアトンアップ化粧下地,809
2026-02-01,베이스_월간,31,hince,トゥルーディメンションラディアンスバーム,2326
2026-02-01,베이스_월간,32,TFIT,アイシーフィットカバークッションEX,2260
2026-02-01,베이스_월간,33,フィー,"クッショングラスナチュラル, 本品",2317
2026-02-01,베이스_월간,34,クリオ,"メッシュグロウエッセンシャルクッション, 本品+レフィル",2884
2026-02-01,베이스_월간,35,glow,ノットドライコンシーラー,2691
2026-02-01,베이스_월간,36,UIQ,バイオームバリアエッセンスインパウダー,802
2026-02-01,베이스_월간,37,YUNJAC,"スキンパーフェクティングプロテクティブベースプレップ, 25ml",2308
2026-02-01,베이스_월간,38,23yearsold,ダーマシンゼロセバムライスパウダー,1207
2026-02-01,베이스_월간,39,フィー,"クッショングラスオリジナル, 本品",2317
2026-02-01,베이스_월간,40,hince,"セカンドスキングロウクッション, 本品",2202
2026-02-01,베이스_월간,41,SISTER ANN,"ピンクエッセンスカバーパクト, 本品",2819
2026-02-01,베이스_월간,42,Funny Elves,ロングウェアファンデーション,809
2026-02-01,베이스_월간,43,CHASIN’ RABBITS,"オールアバウトグロウトーンアップクリーム, 50ml",1531
2026-02-01,베이스_월간,44,エイプリルスキン,トーンアップスキンティント,1915
2026-02-01,베이스_월간,45,TFIT,"スキンカバーBB クリーム, 30g",1363
2026-02-01,베이스_월간,46,ブイディーエル,ローズPDRNプレップベース,2584
2026-02-01,베이스_월간,47,D-RAY,"D-クリアファンデーション, 本品",1944
2026-02-01,베이스_월간,48,MAYBELLINE NEW YORK,SPステイ ルミマット リキッド ファンデーション,2992
2026-02-01,베이스_월간,49,Forencos,タトゥーウォータープルーフスカーコンシーラー,1336
2026-02-01,베이스_월간,50,NAMING,"レイヤードフィットクッション, 本品",2350
2026-02-01,베이스_월간,51,PERFECT DIARY,スターダストダイヤモンドハイライトパウダー,1847
2026-02-01,베이스_월간,52,Ririmew,"トーンアップカラープライマー, 30ml",1426
2026-02-01,베이스_월간,53,ティルティル,"マスクフィットトーンアップクリーム, 50ml",1960
2026-02-01,베이스_월간,54,ラネージュ,"ネオクッション, 本品",1790
2026-02-01,베이스_월간,55,AGE 20'S,ケアグロウハイライター「saki エディション」,1619
2026-02-01,베이스_월간,56,エチュード,ポンポンヘアシャドウ,1604
2026-02-01,베이스_월간,57,アンジエンド,ピンクプライマー,1794
2026-02-01,베이스_월간,58,エスポア,ストロービングハイライター,2406
2026-02-01,베이스_월간,59,ルナ,アーティストミキシングコンシーラー,1903
2026-02-01,베이스_월간,60,ABOUT TONE,スキンレイヤーカバーフィットコンシーラー,1069
2026-02-01,베이스_월간,61,Funny Elves,ノートレースシースルーセッティングパウダー,2146
2026-02-01,베이스_월간,62,ティルティル,マスクフィットオールカバーデュアルコンシーラー,1470
2026-02-01,베이스_월간,63,ティルティル,シルエットコントゥアスティック,1426
2026-02-01,베이스_월간,64,ティルティル,"マスクフィットオールカバークッション, 本品",2406
2026-02-01,베이스_월간,65,クリオ,"キルカバーハイグロウクッション, 本品+レフィル",2584
2026-02-01,베이스_월간,66,Dinto,雲楚ライトベール カラーコレクター&コンシーラー,1312
2026-02-01,베이스_월간,67,クリオ,"キルカバーファンウェアクッション, 本品＋レフィル",2884
2026-02-01,베이스_월간,68,ブイディーエル,"カバーステインパーフェクティングファンデーション, 30ml",2940
2026-02-01,베이스_월간,69,ウォンジョンヨ,"トーンアップベース N, 25g",1430
2026-02-01,베이스_월간,70,エチュード,コントゥアスティック,1134
2026-02-01,베이스_월간,71,ウェイクメイク,"シームレスウェアクッション, 本品+レフィル",2341
2026-02-01,베이스_월간,72,トゥークールフォースクール,アートクラスデュアルコントゥアスティック,1133
2026-02-01,베이스_월간,73,ナンバーズイン,"3番 ノーファンデ陶器肌トーンアップクリーム, 50ml",2349
2026-02-01,베이스_월간,74,タッチインソル,スキンカバークッション ,2835
2026-02-01,베이스_월간,75,パープリッシュ,"ソフトトーニングクッション, 本品",2827
2026-02-01,베이스_월간,76,タッチインソル,ノーポアブレムミネラルパウダー,792
2026-02-01,베이스_월간,77,TFIT,"ルミネアスキップトーンアップクリーム, 100g",1450
2026-02-01,베이스_월간,78,hince,"カバーマスターピンククッション, 本品",2202
2026-02-01,베이스_월간,79,ティルティル,"マスクフィットレッドファンデーション, 30ml",2406
2026-02-01,베이스_월간,80,ティルティル,マスクフィットコンシーラーパレット,1960
2026-02-01,베이스_월간,81,ロムアンド,ベターザンコントゥア,2138
2026-02-01,베이스_월간,82,ブイディーエル,"カバーステインパーフェクティングクッションファンデーション, 本品",2940
2026-02-01,베이스_월간,83,ブイディーエル,"トーンステインカラーコレクティングプライマー, 13ml, 2個",1426
2026-02-01,베이스_월간,84,JOOCYEE,ルミナスフィットペン,1207
2026-02-01,베이스_월간,85,MilleFée,チート顔コントゥアパレット,1936
2026-02-01,베이스_월간,86,ジョンセンムル,"エッセンシャルスキンヌーダーロングウェアクッション, 本品+レフィル",4366
2026-02-01,베이스_월간,87,エチュード,コントゥアパウダー,1693
2026-02-01,베이스_월간,88,ペリペラ,ブイシェーディング,1215
2026-02-01,베이스_월간,89,シピシピ,フィットスキンクッション,2227
2026-02-01,베이스_월간,90,HARIAS,"クッションファンデーション, 本品",2851
2026-02-01,베이스_월간,91,NUDIQUE,"シアーグロウベース, 35ml",2592
2026-02-01,베이스_월간,92,クリオ,プリズムハイライト[25AD],1944
2026-02-01,베이스_월간,93,ウェイクメイク,ディファイニングカバーコンシーラー,1207
2026-02-01,베이스_월간,94,ザセム,"カバーパーフェクションチップコンシーラー, 3個",1417
2026-02-01,베이스_월간,95,フィー,グリッツストーンハイライター,1693
2026-02-01,베이스_월간,96,NAMING,セラムスキンベース,1158
2026-02-01,베이스_월간,97,ABOUT TONE,"スキンレイヤーフィットクッション, 本品",2584
2026-02-01,베이스_월간,98,タッチインソル,グロウエアークッション,2673
2026-02-01,베이스_월간,99,HARIAS,クッションファンデーション + フェイスパウダー,6010
2026-02-01,베이스_월간,100,タッチインソル,プリティフィルターインマイハートスティックファンデーション,2673
2026-02-01,포인트_월간,1,エイプリルスキン,ヒーローリップタトゥーティント,1579
2026-02-01,포인트_월간,2,ロムアンド,ハンオールブロウカラ,980
2026-02-01,포인트_월간,3,NAMING,オーバーデューグロッシーリップティント,1426
2026-02-01,포인트_월간,4,hince,ニューブラーティント,1524
2026-02-01,포인트_월간,5,2ªN,デュアルチーク,1515
2026-02-01,포인트_월간,6,AZTK,ジェリーカラーチークリキッド,1045
2026-02-01,포인트_월간,7,AOU,ブレンディングリップペンシル,1295
2026-02-01,포인트_월간,8,カラーグラム,ギークヌードカラーカバーティント,964
2026-02-01,포인트_월간,9,FEG,FEGまつ毛美容液,737
2026-02-01,포인트_월간,10,ミルクタッチ,ジェリーフィットティンティッドグロウティント,1426
2026-02-01,포인트_월간,11,OIAD,スレインハイパーグロウ,1369
2026-02-01,포인트_월간,12,Laka,フルーティーグラムティント,1588
2026-02-01,포인트_월간,13,Laka,スージングプレップリップマスク,1563
2026-02-01,포인트_월간,14,soaddicted,アイラッシュコンディショニングセラム アドバンス,11000
2026-02-01,포인트_월간,15,フィー,"3Dボリューミンググロス, 2個",2851
2026-02-01,포인트_월간,16,インガ,パウダーブラーリップスティック,1693
2026-02-01,포인트_월간,17,MARSHIQUE,セルフまつげパーマキット,2632
2026-02-01,포인트_월간,18,コスノリ,"イージーブロウチェンジャー, 5回分",2245
2026-02-01,포인트_월간,19,アミューズ,ジェルフィットグロス,1283
2026-02-01,포인트_월간,20,ラネージュ,"リップスリーピングマスクEX, 20g",1915
2026-02-01,포인트_월간,21,NAMING,デューアップハートリップグロス,1336
2026-02-01,포인트_월간,22,Mooekiss,ダブルエッセンスリップティント,1259
2026-02-01,포인트_월간,23,hince,ロウグロウジェルティント,1524
2026-02-01,포인트_월간,24,ホリカホリカ,マイフェイブピースシャドウ,729
2026-02-01,포인트_월간,25,デイジーク,シャドウパレット,3078
2026-02-01,포인트_월간,26,MAYBELLINE NEW YORK,SPフラッフブロウムース,1672
2026-02-01,포인트_월간,27,Pyt,ゲンバリップティント,1588
2026-02-01,포인트_월간,28,ミルクタッチ,スプレッドフィットブラーティント,1595
2026-02-01,포인트_월간,29,EYE2IN,セルフまつげパーマ9種10回分セット,2024
2026-02-01,포인트_월간,30,Laka,デビルリップ,1563
2026-02-01,포인트_월간,31,ロムアンド,ザジューシーラスティングティント,1069
2026-02-01,포인트_월간,32,クリオ,プロアイパレットエアー,2422
2026-02-01,포인트_월간,33,コスノリ,ロングアクティブアイラッシュセラム,1458
2026-02-01,포인트_월간,34,NAMING,フラッフィーパウダーブラッシュ,1336
2026-02-01,포인트_월간,35,ミルクタッチ,アイコニックマスカラ,1318
2026-02-01,포인트_월간,36,インガ,"ウォーターダブルラスティングセンティッドティント, ",1369
2026-02-01,포인트_월간,37,ウェイクメイク,ソフトブラーリングアイパレット,2260
2026-02-01,포인트_월간,38,LUMMIR,ライトオンアイズシャドウパレット,2673
2026-02-01,포인트_월간,39,ロムアンド,グラスティングカラーグロス,1069
2026-02-01,포인트_월간,40,インガ,ブラーリングベルベットマットティント,989
2026-02-01,포인트_월간,41,ペリペラ,インクグラスティングリップグロス,1126
2026-02-01,포인트_월간,42,Dinto,ブラーグロウイリップティント,1515
2026-02-01,포인트_월간,43,アミューズ,バナナリップオイル,1138
2026-02-01,포인트_월간,44,デイジーク,プロスリムブロウカラ,972
2026-02-01,포인트_월간,45,Laka,マキシグレイヤーティント,1563
2026-02-01,포인트_월간,46,EYE2IN,セルフまつげパーマ5回分トライアルキット,1457
2026-02-01,포인트_월간,47,ペリペラ,シロッピートックチーク,1126
2026-02-01,포인트_월간,48,シピシピ,デューイフィルムティントR,1430
2026-02-01,포인트_월간,49,エチュード,カールフィックスマスカラ,1336
2026-02-01,포인트_월간,50,EITHER&,デューイシロップティント,1323
2026-02-01,포인트_월간,51,ペリペラ,ピュアブラッシュドサンシャインチーク,632
2026-02-01,포인트_월간,52,SISTER ANN,"ウォータープルーフペンシルアイライナー, 2個",1604
2026-02-01,포인트_월간,53,ENTROPY MAKEUP,チュールグロス,3240
2026-02-01,포인트_월간,54,ミュード,インスパイアスキニーブロウカラ,1134
2026-02-01,포인트_월간,55,クリオ,ベルベットリップライナー,1134
2026-02-01,포인트_월간,56,ブイディーエル,チークステインブラッシャー,1871
2026-02-01,포인트_월간,57,デイジーク,プロディテールブロウペンシル,1134
2026-02-01,포인트_월간,58,shaishaishai,サンキスドプランプリップバーム,1336
2026-02-01,포인트_월간,59,ノエット,ベアシンチーク,2009
2026-02-01,포인트_월간,60,ティルティル,ウォーターリズムグロウティント,1336
2026-02-01,포인트_월간,61,ハートパーセント,ドットオンムードリップペンシル,1206
2026-02-01,포인트_월간,62,AOU,ソフトクリームチーク,1660
2026-02-01,포인트_월간,63,ホリカホリカ,マイフェイブムードアイシャドウパレット,2101
2026-02-01,포인트_월간,64,ノエット,ベアシンスティック + ベアシンチーク,4147
2026-02-01,포인트_월간,65,Laka,ボンディンググロウリップスティック,1669
2026-02-01,포인트_월간,66,ジョンセンムル,アーティストクッションブラッシュ,1782
2026-02-01,포인트_월간,67,BBIA,レディトゥウェアアイパレット,1296
2026-02-01,포인트_월간,68,AGE 20'S,ベルベットヘーズブラッシャー,1923
2026-02-01,포인트_월간,69,LEPOREM,"セルフまつ毛カールキット, 5回分",1361
2026-02-01,포인트_월간,70,ラネージュ,リップグロウィバーム,1515
2026-02-01,포인트_월간,71,エスポア,クチュールリップティントグレイズ,1615
2026-02-01,포인트_월간,72,LEPOREM,まつ毛美容液アイラッシュセラム,990
2026-02-01,포인트_월간,73,SISTER ANN,ウォータープルーフペンシルアイライナー,1045
2026-02-01,포인트_월간,74,ロムアンド,ベターザンパレット,2584
2026-02-01,포인트_월간,75,カラーグラム,ヌーディーブラーティント,964
2026-02-01,포인트_월간,76,ミュード,インスパイアスキニーマスカラ&マルチフィクサー,1215
2026-02-01,포인트_월간,77,qruam,アイチューニングライナー,1604
2026-02-01,포인트_월간,78,BBIA,グロウリップティント,1215
2026-02-01,포인트_월간,79,Pyt,ゲンバリキッドチーク,1604
