일자,카테고리,순위,브랜드,상품명,가격
2026-02-01,포인트_월간,80,JUDYDOLL,わがままチークハイライター,1295
2026-02-01,포인트_월간,81,MAYBELLINE NEW YORK,スカイハイマスカラ,1410
2026-02-01,포인트_월간,82,ラネージュ,グレイズティントリップセラム,1782
2026-02-01,포인트_월간,83,ICLIONE,"セルフまつげパーマ, 10回分",1903
2026-02-01,포인트_월간,84,リリーバイレッド,ラブビームチークバーム,1069
2026-02-01,포인트_월간,85,ノエット,ベアシンスティック,2138
2026-02-01,포인트_월간,86,ペリペラ,インクグラスティングリップグロス,964
2026-02-01,포인트_월간,87,ペリペラ,ピュアブラッシュドサンシャインチーク,635
2026-02-01,포인트_월간,88,クリオ,クリスタルグラムバーム,1377
2026-02-01,포인트_월간,89,ミュード,アイラッシュティンティングセラムショット,1239
2026-02-01,포인트_월간,90,MilleFée,シェイクドロップチーク,1579
2026-02-01,포인트_월간,91,クリオ,エッセンシャルリップチークタップ,1604
2026-02-01,포인트_월간,92,コスノリ,"セルフまつ毛パーマキット, 5回分",2406
2026-02-01,포인트_월간,93,インガ,ウォーターグロウリップティント,1369
2026-02-01,포인트_월간,94,JOOCYEE,とろ蜜リップペン,1369
2026-02-01,포인트_월간,95,デイジーク,ムードシャドウパレット,3637
2026-02-01,포인트_월간,96,ミュード,インスパイアカーリングマスカラ,1539
2026-02-01,포인트_월간,97,コスノリ,アイラッシュコーティングセラム,1336
2026-02-01,포인트_월간,98,ブイディーエル,チークステインリキッドブラッシャー,1604
2026-02-01,포인트_월간,99,VIDIVICI,ペプチドバターティントバーム,1531
2026-02-01,포인트_월간,100,フィー,"3Dボリューミングティント, 2個",2851
