일자,카테고리,순위,브랜드,상품명,가격
2026-01-12,스킨케어_주간,27,アヌア,"3セラミドパンテノールモイスチャーバリアクリーム, 100ml",2800
2026-01-12,스킨케어_주간,28,メディキューブ,"ゼロ毛穴パッド 2.0, 70枚",2400
2026-01-12,스킨케어_주간,29,原料工房,"アズレンブルークレンジングバーム, 100ml",2200
2026-01-12,스킨케어_주간,30,manyo,"ピュアクレンジングオイル, 200ml",2430
2026-01-12,스킨케어_주간,31,UIQ,"バイオームバリアパンテンシブクリーム, 50ml",2890
2026-01-12,스킨케어_주간,32,アテニア,"スキンクリアクレンズオイル - 無香, 175ml",1980
2026-01-12,스킨케어_주간,33,ODELOI,"ブラックチェリー毛穴収縮クリームルフティグ, 100ml",2261
2026-01-12,스킨케어_주간,34,celimax,"THEビタAレチナールショットタイトニングブースター, 15ml",2640
2026-01-12,스킨케어_주간,35,セラディックス,131パッケージセット,3600
2026-01-12,스킨케어_주간,36,オーズナリー,"ビタ３セラム, 50ml",2850
2026-01-12,스킨케어_주간,37,SKIN1004,"センテラクイックカーミングパッド, 70枚",3135
2026-01-12,스킨케어_주간,38,COSRX,"RXザ6ペプチドスキンブースターセラム, 150ml",2356
2026-01-12,스킨케어_주간,39,ODELOI,"弱酸性毛穴収縮ニドソープ, 120g",1928
2026-01-12,스킨케어_주간,40,メディキューブ,"アゼライン酸ナイアシンアミドクリアトナー, 250ml",2300
2026-01-12,스킨케어_주간,41,バイオヒールボ,"プロバイオダーム3Dリフティングクリーム, 50ml, ",3150
2026-01-12,스킨케어_주간,42,AESTURA,"アトバリア365クリームミスト, 120ml",2500
2026-01-12,스킨케어_주간,43,Kopher,"キュリペアダーマアンプル, 100ml",4800
2026-01-12,스킨케어_주간,44,manyo,"ピュアクレンジングオイル, 400ml",3880
2026-01-12,스킨케어_주간,45,COSRX,"フルフィットプロポリスシナジートナー, 150ml",1795
2026-01-12,스킨케어_주간,46,ウェルダーマ,"ティーツリースージングハーブトックスピーリングパック, 150g",2160
2026-01-12,스킨케어_주간,47,トゥヴェール,"ナノエマルジョンディープ, 60ml",3610
2026-01-12,스킨케어_주간,48,Sung Boon Editor,"シルクペプチドEGFハートフィットボリュームアンプル, 40ml",2900
2026-01-12,스킨케어_주간,49,スキンアンドラブ,"TXナイアシンエッセンストナー, 200ml",2590
2026-01-12,스킨케어_주간,50,スキンアンドラブ,"レチノールリペアセラム, 30ml",2690
2026-01-12,스킨케어_주간,51,アイオペ,"レチノールレチジェクションセラム2%, 30ml",6018
2026-01-12,스킨케어_주간,52,Sung Boon Editor,"グリーントマトNMNポアリフティングアンプル, 40ml",2900
2026-01-12,스킨케어_주간,53,ナンバーズイン,"5番 白玉グルタチオンＣ美容液, 30ml",2800
2026-01-12,스킨케어_주간,54,センテリアン24,マデカクリームシグネチャーエディション,4100
2026-01-12,스킨케어_주간,55,セラディックス,"ビタKダーククリア アイクリーム, 15ml",2300
2026-01-12,스킨케어_주간,56,SKIN1004,"プロバイオシカインテンシブアンプル, 50ml",2945
2026-01-12,스킨케어_주간,57,ラゴム,"ジェルトゥウォータークレンザー [朝洗顔], 220ml",2310
2026-01-12,스킨케어_주간,58,ブラン,"マジックティーツリーオイル, 20ml, 2個",5020
2026-01-12,스킨케어_주간,59,アヌア,"PDRNヒアルロン酸100モイスチャライジングクリーム, 60ml",3200
2026-01-12,스킨케어_주간,60,AESTURA,"アトバリア365ローション, 150ml",3300
2026-01-12,스킨케어_주간,61,SKIN1004,"センテラライトクレンジングオイル, 200ml",2470
2026-01-12,스킨케어_주간,62,メディヒール,"ホワイトミルクブライトニングトナー, 300ml",2587
2026-01-12,스킨케어_주간,63,Yunth,"生VC美白美容液, 28個",3960
2026-01-12,스킨케어_주간,64,アヌア,"ドクダミセンテラレッドスポットクリーム, 30g",2200
2026-01-12,스킨케어_주간,65,ダルバ,"ビタトーニングガルバニックリンクルアイクリーム, 15ml",3900
2026-01-12,스킨케어_주간,66,REJUALL,"PDRNリジュビネイティングクリーム, 20ml",3990
2026-01-12,스킨케어_주간,67,ラゴム,"ジェルトゥウォータークレンザー [朝洗顔], 220ml, 2個",4400
2026-01-12,스킨케어_주간,68,ダルバ,"ホワイトトリュフファーストスプレーセラム, 100ml",2700
2026-01-12,스킨케어_주간,69,メディキューブ,"アゼライン酸16BBカーミングセラム, 30ml",2800
2026-01-12,스킨케어_주간,70,CKD_GUARANTEED,"レチノコラーゲン低分子300毛穴弾力マスク, 5枚",2061
2026-01-12,스킨케어_주간,71,トリデン,"セルメイジングビタCアンプル, 30ml",2347
2026-01-12,스킨케어_주간,72,ダルバ,"オールデイセラムメイクアップフィクサー, 80ml",3200
2026-01-12,스킨케어_주간,73,celimax,"ノニエネルギーアンプル, 30ml",2860
2026-01-12,스킨케어_주간,74,Beauty of Joseon,"赤小豆毛穴マスク, 140ml",2350
2026-01-12,스킨케어_주간,75,センテリアン24,"エキスパートマデカクリームリニューPDRN, 50ml",2860
2026-01-12,스킨케어_주간,76,celimax,"ノニアクネバブルクレンザー, 155ml",1640
2026-01-12,스킨케어_주간,77,KITEN,"レチノールシカクリーム, 20g",2980
2026-01-12,스킨케어_주간,78,メディキューブ,"エクソソームシカアンプル, 30ml",2800
2026-01-12,스킨케어_주간,79,haruharu wonder,"ブラックライスモイスチャーディープクレンジングオイル, 150ml",2400
2026-01-12,스킨케어_주간,80,ヴィーガンイフェクト,"青麦クレンジングジェル, 205ml",3630
2026-01-12,스킨케어_주간,81,ハートパーセント,"ブライトニングクレンジングバーム, 80ml, 2個",3958
2026-01-12,스킨케어_주간,82,バイオヒールボ,"プロバイオダームコラーゲンリモデリングクリーム, 50ml",2790
2026-01-12,스킨케어_주간,83,ブラン,"マジックシカクリーム, 60ml, 2個",8620
2026-01-12,스킨케어_주간,84,ブラン,"毛穴アンプル, 30ml, 2個",3880
2026-01-12,스킨케어_주간,85,メディキューブ,"コウジ酸ビタピールショット, 80ml",2400
2026-01-12,스킨케어_주간,86,リジュラン,"デュアルエフェクトアンプル, 30ml",6421
2026-01-12,스킨케어_주간,87,ダルバ,"ビタトーニングセラムトナー, 180ml",2540
2026-01-12,스킨케어_주간,88,irecipe,"シカPDRN跡クリアトナーパッド, 70枚",1407
2026-01-12,스킨케어_주간,89,punbaki,"アデノシンピンクエッセンシャルトナー, 150ml",2950
2026-01-12,스킨케어_주간,90,ラロッシュポゼ,"シカプラストリペアクリームB5+, 40ml",2899
2026-01-12,스킨케어_주간,91,ドクターオラクル,"EPLキュアセラムXD, 30ml",2950
2026-01-12,스킨케어_주간,92,KITEN,"ハイドロキノンクリーム, 20g",2980
2026-01-12,스킨케어_주간,93,バイオヒールボ,"プロバイオダーム3Dリフティングアイ＆リンクルクリーム, 25ml, 2個",2750
2026-01-12,스킨케어_주간,94,メディキューブ,"ゼロ毛穴クレイパック, 100g",2120
2026-01-12,스킨케어_주간,95,De:maf,"マイファーストセラム, 155ml , ",3400
2026-01-12,스킨케어_주간,96,manyo,"ガラクトミークリアスキントナー, 210ml",2400
2026-01-12,스킨케어_주간,97,ナンバーズイン,"5番 白玉グルタチオンCメラゼロクリーム, 50ml",2800
2026-01-12,스킨케어_주간,98,バイオヒールボ,"プロバイオダーム3DリフティングバイオトクシルPLGAセラム, 30ml",3300
2026-01-12,스킨케어_주간,99,アヌア,"ドクダミ70インテンスカーミングクリーム, 50ml",2800
2026-01-12,스킨케어_주간,100,SKIN1004,"トーンブライトニングカプセルアンプル, 50ml",2470
2026-01-12,베이스_주간,1,23yearsold,ダーマシンコンシーラー,1580
2026-01-12,베이스_주간,2,エイプリルスキン,"ヒーロークッション, 本品+レフィル",3700
2026-01-12,베이스_주간,3,ABOUT TONE,"スキンレイヤーフィットファンデーション, 3ml",350
2026-01-12,베이스_주간,4,CHASIN’ RABBITS,"オールアバウトグロウカバークリーム, 35ml",999
2026-01-12,베이스_주간,5,ブラン,"皮脂ゼロエアフィットクッション, 本品",2980
2026-01-12,베이스_주간,6,ABOUT TONE,スキンレイヤーフィットファンデーション,3080
2026-01-12,베이스_주간,7,JUDYDOLL,メリハリマスターパレット,2090
2026-01-12,베이스_주간,8,オフラ,"ハイライター, ミニ",2541
2026-01-12,베이스_주간,9,ティルティル,マスクフィットルビーメッシュクッション,2673
2026-01-12,베이스_주간,10,2ªN,ピュアグラッシュハイライター,1430
2026-01-12,베이스_주간,11,ティルティル,"マスクフィットトーンアップエッセンス, 30ml",2970
2026-01-12,베이스_주간,12,TFIT,カバーアッププロコンシーラー,1485
2026-01-12,베이스_주간,13,ByUR,セラムフィットルースフェイスパウダー,2090
2026-01-12,베이스_주간,14,ルナ,コンシールブレンダーパレット,2350
2026-01-12,베이스_주간,15,ジョンセンムル,"エッセンシャルスキンヌーダークッション, 本品",3520
2026-01-12,베이스_주간,16,ウェイクメイク,"シームレスウェアファンデーション, 30ml, スパチュラブラシ付き",3230
2026-01-12,베이스_주간,17,アイムミミ,アイムマルチスティックデュアル,1650
2026-01-12,베이스_주간,18,PERFECT DIARY,フローレスクッションファンデーション,2970
2026-01-12,베이스_주간,19,glow,"ブリーザブルBBクリーム, 30ml",3740
2026-01-12,베이스_주간,20,ブイディーエル,"トーンステインカラーコレクティングプライマー, 30ml",3080
2026-01-12,베이스_주간,21,オフラ,"ハイライター, ミニ, 2個",4929
2026-01-12,베이스_주간,22,スキンフード,サーモンダークサークルコンシーラークリーム,1100
2026-01-12,베이스_주간,23,Funny Elves,ソフトマットプレストパウダー,2750
2026-01-12,베이스_주간,24,トゥークールフォースクール,ヴェールドコントゥア,2490
2026-01-12,베이스_주간,25,ナンバーズイン,5番 白玉グルタチオンＣトーンアップベース,2500
2026-01-12,베이스_주간,26,エイプリルスキン,"マジックスノークッション, 本品+レフィル",3700
2026-01-12,베이스_주간,27,ティルティル,"マスクフィットレッドクッション, 本品",2970
2026-01-12,베이스_주간,28,ダルバ,"グロウフィットセラムカバークッション, 本品",3200
2026-01-12,베이스_주간,29,CHASIN’ RABBITS,"オールアバウトグロウトーンアップクリーム, 50ml",999
2026-01-12,베이스_주간,30,Funny Elves,ロングウェアファンデーション,999
2026-01-12,베이스_주간,31,トゥークールフォースクール,アートクラスバイロダンシェーディング,1629
2026-01-12,베이스_주간,32,ルナ,アーティストミキシングコンシーラー,2350
2026-01-12,베이스_주간,33,hince,トゥルーディメンションラディアンスバーム,2580
2026-01-12,베이스_주간,34,ウェイクメイク,"ウォーターグロウコーティングバーム, 本品+レフィル",2890
2026-01-12,베이스_주간,35,クリオ,"メッシュグロウエッセンシャルクッション, 本品+レフィル",3560
2026-01-12,베이스_주간,36,glow,ノットドライコンシーラー,3630
2026-01-12,베이스_주간,37,TFIT,アイシーフィットカバークッションEX,2574
2026-01-12,베이스_주간,38,ティルティル,"マスクフィットAIフィルタークッション, 本品",2970
2026-01-12,베이스_주간,39,hince,"セカンドスキングロウクッション, 本品",2816
2026-01-12,베이스_주간,40,フィー,"クッショングラスナチュラル, 本品",2860
2026-01-12,베이스_주간,41,23yearsold,ダーマシンゼロセバムライスパウダー,1490
2026-01-12,베이스_주간,42,セルフュージョンC,"スキンブレミッシュバームインテンシブ, 30ml",2880
2026-01-12,베이스_주간,43,PERFECT DIARY,スターダストダイヤモンドハイライトパウダー,2990
2026-01-12,베이스_주간,44,トゥークールフォースクール,アートクラスデュアルコントゥアスティック,1499
2026-01-12,베이스_주간,45,ラネージュ,"ネオクッションミューイ, 本品",3520
2026-01-12,베이스_주간,46,YUNJAC,"スキンパーフェクティングプロテクティブベースプレップ, 25ml",3800
2026-01-12,베이스_주간,47,ABOUT TONE,スキンレイヤーカバーフィットコンシーラー,1320
2026-01-12,베이스_주간,48,フィー,"クッショングラスオリジナル, 本品",2860
2026-01-12,베이스_주간,49,SISTER ANN,"ピンクエッセンスカバーパクト, 本品",2490
2026-01-12,베이스_주간,50,フィー,ファンデーショングラス,2673
2026-01-12,베이스_주간,51,ティルティル,"マスクフィットトーンアップクリーム, 50ml",2420
2026-01-12,베이스_주간,52,ティルティル,マスクフィットコンシーラーパレット,1122
2026-01-12,베이스_주간,53,ABOUT TONE,"ウォーターレイヤーフィットクッション, 本品",3190
2026-01-12,베이스_주간,54,Forencos,タトゥーウォータープルーフスカーコンシーラー,1650
2026-01-12,베이스_주간,55,TFIT,"スキンカバーBB クリーム, 30g",1683
2026-01-12,베이스_주간,56,アンジエンド,ピンクプライマー,2680
2026-01-12,베이스_주간,57,Funny Elves,ノートレースシースルーセッティングパウダー,2980
2026-01-12,베이스_주간,58,ブイディーエル,ローズPDRNプレップベース,3190
2026-01-12,베이스_주간,59,Ririmew,"トーンアップカラープライマー, 30ml",1760
2026-01-12,베이스_주간,60,TFIT,"ルミネアスキップトーンアップクリーム, 100g",1683
2026-01-12,베이스_주간,61,ウォンジョンヨ,"トーンアップベース N, 25g",1430
2026-01-12,베이스_주간,62,エチュード,ポンポンヘアシャドウ,1980
2026-01-12,베이스_주간,63,クリオ,"キルカバーファンウェアクッション, 本品＋レフィル",3560
2026-01-12,베이스_주간,64,エスポア,ストロービングハイライター,2805
2026-01-12,베이스_주간,65,クリオ,"キルカバーハイグロウクッション, 本品+レフィル",3190
2026-01-12,베이스_주간,66,ジョンセンムル,"エッセンシャルスキンヌーダーロングウェアクッション, 本品+レフィル",4950
2026-01-12,베이스_주간,67,ブイディーエル,"カバーステインパーフェクティングファンデーション, 30ml",3630
2026-01-12,베이스_주간,68,カラーグラム,ぷるんジェリービームスティック,1190
2026-01-12,베이스_주간,69,ロムアンド,ベターザンコントゥア,2400
2026-01-12,베이스_주간,70,hince,"カバーマスターピンククッション, 本品",2816
2026-01-12,베이스_주간,71,エイプリルスキン,トーンアップスキンティント,2364
2026-01-12,베이스_주간,72,シピシピ,フィットスキンクッション,2750
2026-01-12,베이스_주간,73,ティルティル,マスクフィットオールカバーデュアルコンシーラー,1815
2026-01-12,베이스_주간,74,ナンバーズイン,"3番 ノーファンデ陶器肌トーンアップクリーム, 50ml",2500
2026-01-12,베이스_주간,75,ティルティル,"マスクフィットクリスタルメッシュクッション, 本品",2970
2026-01-12,베이스_주간,76,フィー,グリッツストーンハイライター,2090
2026-01-12,베이스_주간,77,ラネージュ,"ネオクッション, 本品",3300
2026-01-12,베이스_주간,78,ブイディーエル,"トーンステインカラーコレクティングプライマー, 13ml, ",1760
2026-01-12,베이스_주간,79,MilleFée,チート顔コントゥアパレット,2390
2026-01-12,베이스_주간,80,ティルティル,シルエットコントゥアスティック,1760
2026-01-12,베이스_주간,81,クリオ,プリズムハイライト[25AD],2400
2026-01-12,베이스_주간,82,エチュード,コントゥアスティック,1400
2026-01-12,베이스_주간,83,ティルティル,"マスクフィットレッドファンデーション, 30ml",2970
2026-01-12,베이스_주간,84,MAYBELLINE NEW YORK,SPステイ ルミマット リキッド ファンデーション,2992
2026-01-12,베이스_주간,85,ブイディーエル,"トーンステインカラーコレクティングプライマー, 13ml, 2個",3520
2026-01-12,베이스_주간,86,ジョンセンムル,"スキンヌーダーカバーレイヤークッション, 本品+レフィル",4950
2026-01-12,베이스_주간,87,ウェイクメイク,"シームレスウェアクッション, 本品+レフィル",2890
2026-01-12,베이스_주간,88,Dinto,雲楚ライトベール カラーコレクター&コンシーラー,1620
2026-01-12,베이스_주간,89,NUDIQUE,"シアーグロウベース, 35ml",3200
2026-01-12,베이스_주간,90,ウェイクメイク,ディファイニングカバーコンシーラー,1490
2026-01-12,베이스_주간,91,BBIA,オーステイコンシーラー,1210
2026-01-12,베이스_주간,92,エチュード,シューティングビームハイライター,1430
2026-01-12,베이스_주간,93,ジョンセンムル,血色メイクセット,6000
2026-01-12,베이스_주간,94,HARIAS,"クッションファンデーション, 本品",3520
2026-01-12,베이스_주간,95,BeginS,"ポアケアリングメッシュクッション, 本品",3300
2026-01-12,베이스_주간,96,HARIAS,"クッションファンデーション, レフィル",3280
2026-01-12,베이스_주간,97,JOOCYEE,ルミナスフィットペン,1790
2026-01-12,베이스_주간,98,23yearsold,ハートリーフシンカバークッション,2380
2026-01-12,베이스_주간,99,花西子,玉容桃花ルースパウダー,5060
2026-01-12,베이스_주간,100,SPICARE,V3 エキサイティングファンデーション,8800
2026-01-12,포인트_주간,1,NAMING,オーバーデューグロッシーリップティント,1760
2026-01-12,포인트_주간,2,2ªN,デュアルチーク,1870
2026-01-12,포인트_주간,3,ロムアンド,ハンオールブロウカラ,1210
2026-01-12,포인트_주간,4,トゥークールフォースクール,プロタージュペンシル,1380
2026-01-12,포인트_주간,5,AZTK,ジェリーカラーチークリキッド,1290
2026-01-12,포인트_주간,6,AOU,ブレンディングリップペンシル,1119
2026-01-12,포인트_주간,7,トゥークールフォースクール,アートクラススマッジングアンダーライナー,1399
2026-01-12,포인트_주간,8,Laka,スージングプレップリップマスク,1890
2026-01-12,포인트_주간,9,ミルクタッチ,ジェリーフィットティンティッドグロウティント,1760
2026-01-12,포인트_주간,10,FEG,FEGまつ毛美容液,999
2026-01-12,포인트_주간,11,MARSHIQUE,セルフまつげパーマキット,3250
2026-01-12,포인트_주간,12,soaddicted,アイラッシュコンディショニングセラム アドバンス,11000
2026-01-12,포인트_주간,13,フィー,"3Dボリューミンググロス, 2個",3100
2026-01-12,포인트_주간,14,エイプリルスキン,ヒーローリップタトゥーティント,1950
2026-01-12,포인트_주간,15,ミルクタッチ,スプレッドフィットブラーティント,1969
2026-01-12,포인트_주간,16,Mooekiss,ダブルエッセンスリップティント,1790
2026-01-12,포인트_주간,17,カラーグラム,ギークヌードカラーカバーティント,1190
2026-01-12,포인트_주간,18,ホリカホリカ,マイフェイブピースシャドウ,900
2026-01-12,포인트_주간,19,デイジーク,シャドウパレット,3800
2026-01-12,포인트_주간,20,Pyt,ゲンバリップティント,1980
2026-01-12,포인트_주간,21,EYE2IN,セルフまつげパーマ9種10回分セット,2499
2026-01-12,포인트_주간,22,クリオ,プロアイパレットエアー,2990
2026-01-12,포인트_주간,23,Laka,フルーティーグラムティント,1830
2026-01-12,포인트_주간,24,Laka,デビルリップ,1880
2026-01-12,포인트_주간,25,ミルクタッチ,アイコニックマスカラ,1628
2026-01-12,포인트_주간,26,ロムアンド,ザジューシーラスティングティント,1320
2026-01-12,포인트_주간,27,コスノリ,ロングアクティブアイラッシュセラム,1870
2026-01-12,포인트_주간,28,NAMING,フラッフィーパウダーブラッシュ,1650
2026-01-12,포인트_주간,29,AOU,ソフトクリームチーク,1435
2026-01-12,포인트_주간,30,BRAYE,シングロウティント,1680
2026-01-12,포인트_주간,31,ペリペラ,インクグラスティングリップグロス,1390
2026-01-12,포인트_주간,32,LUMMIR,ライトオンアイズシャドウパレット,3300
2026-01-12,포인트_주간,33,アミューズ,ジェルフィットグロス,1760
2026-01-12,포인트_주간,34,ロムアンド,グラスティングカラーグロス,1320
2026-01-12,포인트_주간,35,Laka,マキシグレイヤーティント,1830
2026-01-12,포인트_주간,36,ペリペラ,シロッピートックチーク,1390
2026-01-12,포인트_주간,37,クリオ,ベルベットリップライナー,1400
2026-01-12,포인트_주간,38,EITHER&,デューイシロップティント,1633
2026-01-12,포인트_주간,39,ブイディーエル,チークステインブラッシャー,2310
2026-01-12,포인트_주간,40,ホリカホリカ,マイフェイブムードアイシャドウパレット,2595
2026-01-12,포인트_주간,41,ノエット,ベアシンチーク,2480
2026-01-12,포인트_주간,42,ウェイクメイク,ソフトブラーリングアイパレット,2790
2026-01-12,포인트_주간,43,ティルティル,ウォーターリズムグロウティント,1650
2026-01-12,포인트_주간,44,デイジーク,ブレンディングムードチーク,2490
2026-01-12,포인트_주간,45,ペリペラ,ピュアブラッシュドサンシャインチーク,780
2026-01-12,포인트_주간,46,EYE2IN,セルフまつげパーマ5回分トライアルキット,1799
2026-01-12,포인트_주간,47,エスポア,クチュールリップティントグレイズ,1993
2026-01-12,포인트_주간,48,ジョンセンムル,アーティストクッションブラッシュ,2400
2026-01-12,포인트_주간,49,SISTER ANN,"ウォータープルーフペンシルアイライナー, 2個",1980
2026-01-12,포인트_주간,50,ラネージュ,リップグロウィバーム,1870
2026-01-12,포인트_주간,51,ハートパーセント,ドットオンムードリップペンシル,1540
2026-01-12,포인트_주간,52,ペリペラ,ピュアブラッシュドサンシャインチーク,784
2026-01-12,포인트_주간,53,JUDYDOLL,わがままチークハイライター,1870
2026-01-12,포인트_주간,54,SISTER ANN,ウォータープルーフペンシルアイライナー,990
2026-01-12,포인트_주간,55,Laka,ボンディンググロウリップスティック,2060
2026-01-12,포인트_주간,56,BBIA,レディトゥウェアアイパレット,1600
2026-01-12,포인트_주간,57,ロムアンド,ベターザンパレット,3100
2026-01-12,포인트_주간,58,MilleFée,シェイクドロップチーク,1950
2026-01-12,포인트_주간,59,ICLIONE,"セルフまつげパーマ, 10回分",2350
2026-01-12,포인트_주간,60,ラネージュ,グレイズティントリップセラム,3960
2026-01-12,포인트_주간,61,ミュード,インスパイアスキニーマスカラ&マルチフィクサー,1500
2026-01-12,포인트_주간,62,リリーバイレッド,ラブビームチークバーム,1320
2026-01-12,포인트_주간,63,ペリペラ,インクグラスティングリップグロス,1190
2026-01-12,포인트_주간,64,ミュード,インスパイアカーリングマスカラ,1900
2026-01-12,포인트_주간,65,コスノリ,アイラッシュコーティングセラム,1650
2026-01-12,포인트_주간,66,クリオ,エッセンシャルリップチークタップ,1980
2026-01-12,포인트_주간,67,BBIA,グロウリップティント,1500
2026-01-12,포인트_주간,68,Pyt,ゲンバリキッドチーク,1980
2026-01-12,포인트_주간,69,TOCOBO,ジューシーベリープランピングリップオイル,1440
2026-01-12,포인트_주간,70,AOU,マットバー,1190
2026-01-12,포인트_주간,71,エチュード,ジンジャーシュガーリップセラム,1400
2026-01-12,포인트_주간,72,コスノリ,"セルフまつ毛パーマキット, 5回分",2970
2026-01-12,포인트_주간,73,フィー,"3Dボリューミングティント, 2個",3100
2026-01-12,포인트_주간,74,デイジーク,ムードシャドウパレット,4490
2026-01-12,포인트_주간,75,BBIA,エッセンシャルアイパレット,2750
2026-01-12,포인트_주간,76,AOU,グロウイティントバーム,1393
2026-01-12,포인트_주간,77,ペリペラ,インクムードグロイティント,1091
2026-01-12,포인트_주간,78,ブイディーエル,チークステインリキッドブラッシャー,1980
2026-01-12,포인트_주간,79,JOOCYEE,とろ蜜リップペン,2090
2026-01-12,포인트_주간,80,ウォンジョンヨ,メタルシャワーペンシル,1650
2026-01-12,포인트_주간,81,トゥークールフォースクール,アイグリッツ,1289
