일자,카테고리,순위,브랜드,상품명,가격
2026-01-07,전체_주간,1,メディキューブ,ブースタープロ,28889
2026-01-07,전체_주간,2,アヌア,"PDRNヒアルロン酸カプセル100セラム, 30ml",3200
2026-01-07,전체_주간,3,NAMING,オーバーデューグロッシーリップティント,1760
2026-01-07,전체_주간,4,エイプリルスキン,"ヒーロークッション, 本品+レフィル",3600
2026-01-07,전체_주간,5,AOU,ブレンディングリップペンシル,1119
2026-01-07,전체_주간,6,ブラン,"マジックティーツリーオイル, 20ml",2790
2026-01-07,전체_주간,7,アヌア,"ビタミン10PORESTRIXセラム, 20ml",2800
2026-01-07,전체_주간,8,アヌア,"レチノール0.3ナイアシンリニューイングセラム, 30ml",3200
2026-01-07,전체_주간,9,メディキューブ,"コウジ酸ビタナイアシントナー, 250ml",2300
2026-01-07,전체_주간,10,オフラ,"ハイライター, ミニ",2541
2026-01-07,전체_주간,11,バイオヒールボ,"プロバイオダーム3Dリフティングクリーム, 50ml, 本品+レフィル",5467
2026-01-07,전체_주간,12,ブラン,トラブルケア2種セット,6880
2026-01-07,전체_주간,13,トゥークールフォースクール,プロタージュペンシル,1499
2026-01-07,전체_주간,14,ミルクタッチ,ジェリーフィットティンティッドグロウティント,1707
2026-01-07,전체_주간,15,トゥークールフォースクール,アートクラススマッジングアンダーライナー,1499
2026-01-07,전체_주간,16,COSRX,"RXザアルファアルブチン2ニキビ跡ケアセラム, 50ml",2332
2026-01-07,전체_주간,17,AZTK,ジェリーカラーチークリキッド,1165
2026-01-07,전체_주간,18,ティルティル,マスクフィットルビーメッシュクッション,2821
2026-01-07,전체_주간,19,Brighte,エレキリフトリフ ト,22000
2026-01-07,전체_주간,20,セルフュージョンC,"コラーゲンPDRNアンプル, 35ml",2310
2026-01-07,전체_주간,21,スキンアンドラブ,"グルタチオントナー, 200ml",2590
2026-01-07,전체_주간,22,2ªN,デュアルチーク,1870
2026-01-07,전체_주간,23,ロムアンド,ハンオールブロウカラ,1210
2026-01-07,전체_주간,24,アヌア,"PDRNヒアルロン酸ハイドレイティングミスト, 100ml",2650
2026-01-07,전체_주간,25,AOU,"トーンアップぽよんクリーム, 100ml",1393
2026-01-07,전체_주간,26,ホリカホリカ,マイフェイブピースシャドウ,600
2026-01-07,전체_주간,27,VTコスメティックス,"PDRNカプセルクリーム100, 50ml",2167
2026-01-07,전체_주간,28,manyo,"ガラクナイアシン3.0エッセンス, 30ml",2200
2026-01-07,전체_주간,29,ナンバーズイン,"5番 白玉グルタチオン100xTXA10集中トーニング美容液, 2個",4000
2026-01-07,전체_주간,30,Laka,スージングプレップリップマスク,1890
2026-01-07,전체_주간,31,リジュラン,PDRN化粧水＋クリームセット,14000
2026-01-07,전체_주간,32,原料工房,"アズレンブルークレンジングバーム, 100ml",2100
2026-01-07,전체_주간,33,ラネージュ,"リップスリーピングマスクEX, 20g",2129
2026-01-07,전체_주간,34,ブラン,"マジックシカクリーム, 60ml",4790
2026-01-07,전체_주간,35,lily eve,"グロウターンアンプル, 100ml, 2個",5230
2026-01-07,전체_주간,36,コスノリ,"イージーブロウ·トーン·チェンジャー, 5回分",2400
2026-01-07,전체_주간,37,Ytning,"リンパマッサージクリーム, 120ml",2835
2026-01-07,전체_주간,38,Kopher,"キュリペアメラクリーム, 35ml",3190
2026-01-07,전체_주간,39,ブラン,"皮脂ゼロエアフィットクッション, 本品",2980
2026-01-07,전체_주간,40,アヌア,"ナイアシンアミド10%ダークスポットセラム, 30ml",2800
2026-01-07,전체_주간,41,エイプリルスキン,"リアルカロテンIPMPブレミッシュセラムパックパッド, 80枚",2800
2026-01-07,전체_주간,42,アヌア,"ドクダミポアコントロールクレンジングオイル, 200ml",2100
2026-01-07,전체_주간,43,Redence,"トーン&スポットコレクターアンプル, 30ml",2565
2026-01-07,전체_주간,44,ABOUT TONE,スキンレイヤーフィットファンデーション,2772
2026-01-07,전체_주간,45,SKIN1004,"センテラアンプル, 55ml",2375
2026-01-07,전체_주간,46,COSRX,"RXザビタミンC23セラム2世代, 20g",2389
2026-01-07,전체_주간,47,ABOUT TONE,"スキンレイヤーフィットファンデーション, 3ml",350
2026-01-07,전체_주간,48,PERFECT DIARY,"トランスルーシェントブラーリングセッティンクパウダー, 3g",1870
2026-01-07,전체_주간,49,バイオヒールボ,2026初売り限定福袋,7911
2026-01-07,전체_주간,50,AOU,ソフトクリームチーク,1435
2026-01-07,전체_주간,51,One-day's you,ダクトパッドセット,2550
2026-01-07,전체_주간,52,ティルティル,"マスクフィットトーンアップエッセンス, 30ml",2673
2026-01-07,전체_주간,53,Mooekiss,ダブルエッセンスリップティント,1554
2026-01-07,전체_주간,54,ByUR,セラムフィットルースフェイスパウダー,1881
2026-01-07,전체_주간,55,KATAN,"シカダーマヒットセラム5, 30g",3740
2026-01-07,전체_주간,56,デイジーク,シャドウパレット,3800
2026-01-07,전체_주간,57,カラーグラム,ギークヌードカラーカバーティント,1190
2026-01-07,전체_주간,58,スキンアンドラブ,ケアベアコラボ新年一押しセット,5890
2026-01-07,전체_주간,59,Biodance,NEW X BEST 企画セット,3960
2026-01-07,전체_주간,60,Pyt,ゲンバリップティント,1960
2026-01-07,전체_주간,61,イズエンツリー,"超低分子ヒアルロン酸トナー, 300ml",2400
2026-01-07,전체_주간,62,ミルクタッチ,スプレッドフィットブラーティント,1769
2026-01-07,전체_주간,63,オフラ,"ハイライター, ミニ, 2個",4929
2026-01-07,전체_주간,64,アミューズ,ジェルフィットグロス,1760
2026-01-07,전체_주간,65,FEG,FEGまつ毛美容液,899
2026-01-07,전체_주간,66,ルナ,コンシールブレンダーパレット,2350
2026-01-07,전체_주간,67,ミルクタッチ,アイコニックマスカラ,1579
2026-01-07,전체_주간,68,メディキューブ,"ゼロ毛穴パッド 2.0, 70枚",2400
2026-01-07,전체_주간,69,ODELOI,"ブラックチェリー毛穴収縮クリームルフティグ, 100ml",2261
2026-01-07,전체_주간,70,エイプリルスキン,ヒーローリップタトゥーティント,1950
2026-01-07,전체_주간,71,KATAN,"シカダーマヒットセラム10, 30g",5720
2026-01-07,전체_주간,72,ウェイクメイク,"シームレスウェアファンデーション, 30ml, スパチュラブラシ付き",3380
2026-01-07,전체_주간,73,アイムミミ,アイムマルチスティックデュアル,1440
2026-01-07,전체_주간,74,BnD,"アンダーアームクリーム, 100g",3391
2026-01-07,전체_주간,75,Laka,デビルリップ,1880
2026-01-07,전체_주간,76,Kopher,"キュリペアSOSメルダーシステム, 1.5ml, 20本",5090
2026-01-07,전체_주간,77,soaddicted,アイラッシュコンディショニングセラム アドバンス,11000
2026-01-07,전체_주간,78,アヌア,"3セラミドパンテノールモイスチャーバリアクリーム, 100ml",2800
2026-01-07,전체_주간,79,ドクタージー,"レッドブレミッシュクリアスージングクリーム, 70ml",1944
2026-01-07,전체_주간,80,2ªN,ピュアグラッシュハイライター,1430
2026-01-07,전체_주간,81,punbaki,"アデノシンピンクエッセンシャルトナー, 150ml",2950
2026-01-07,전체_주간,82,Dinto,ブラーグロウイリップティント,1683
2026-01-07,전체_주간,83,コスノリ,ロングアクティブアイラッシュセラム,1770
2026-01-07,전체_주간,84,アヌア,"ライスブライトニング酵素洗顔パウダー, 40g",1950
2026-01-07,전체_주간,85,KISOCARE,"ハイドロクリームPHQ-8, 20g",1480
2026-01-07,전체_주간,86,Laka,フルーティーグラムティント,1830
2026-01-07,전체_주간,87,クリオ,プロアイパレットエアー,2990
2026-01-07,전체_주간,88,UIQ,"バイオームバリアパンテンシブクリーム, 50ml",2890
2026-01-07,전체_주간,89,COSRX,"RXザ6ペプチドスキンブースターセラム, 150ml",2200
2026-01-07,전체_주간,90,ホリカホリカ,マイフェイブムードアイシャドウパレット,2345
2026-01-07,전체_주간,91,Kundal,プレミアムヘアケアスペシャルセット,2399
2026-01-07,전체_주간,92,glow,"ブリーザブルBBクリーム, 30ml",3400
2026-01-07,전체_주간,93,アテニア,"スキンクリアクレンズオイル - 無香, 175ml",1980
2026-01-07,전체_주간,94,ティルティル,ウォーターリズムグロウティント,1633
2026-01-07,전체_주간,95,EITHER&,エッグスリックファンデーション+リップオイルセット,4300
2026-01-07,전체_주간,96,ジョンセンムル,"エッセンシャルスキンヌーダークッション, 本品",3420
2026-01-07,전체_주간,97,Yunth,"生VC美白美容液, 28個",3960
2026-01-07,전체_주간,98,ペリペラ,インクグラスティングリップグロス,1390
2026-01-07,전체_주간,99,ウェイクメイク,ソフトブラーリングアイパレット,2790
2026-01-07,전체_주간,100,センテリアン24,マデカクリームシグネチャーエディション,4100
2026-01-07,스킨케어_주간,1,アヌア,"PDRNヒアルロン酸カプセル100セラム, 30ml",3200
2026-01-07,스킨케어_주간,2,ブラン,"マジックティーツリーオイル, 20ml",2790
2026-01-07,스킨케어_주간,3,アヌア,"ビタミン10PORESTRIXセラム, 20ml",2800
2026-01-07,스킨케어_주간,4,アヌア,"レチノール0.3ナイアシンリニューイングセラム, 30ml",3200
2026-01-07,스킨케어_주간,5,メディキューブ,"コウジ酸ビタナイアシントナー, 250ml",2300
2026-01-07,스킨케어_주간,6,バイオヒールボ,"プロバイオダーム3Dリフティングクリーム, 50ml, 本品+レフィル",5467
2026-01-07,스킨케어_주간,7,COSRX,"RXザアルファアルブチン2ニキビ跡ケアセラム, 50ml",2332
2026-01-07,스킨케어_주간,8,セルフュージョンC,"コラーゲンPDRNアンプル, 35ml",2310
2026-01-07,스킨케어_주간,9,スキンアンドラブ,"グルタチオントナー, 200ml",2590
2026-01-07,스킨케어_주간,10,アヌア,"PDRNヒアルロン酸ハイドレイティングミスト, 100ml",2650
2026-01-07,스킨케어_주간,11,AOU,"トーンアップぽよんクリーム, 100ml",1393
2026-01-07,스킨케어_주간,12,VTコスメティックス,"PDRNカプセルクリーム100, 50ml",2167
2026-01-07,스킨케어_주간,13,manyo,"ガラクナイアシン3.0エッセンス, 30ml",2200
2026-01-07,스킨케어_주간,14,ナンバーズイン,"5番 白玉グルタチオン100xTXA10集中トーニング美容液, 2個",4000
2026-01-07,스킨케어_주간,15,原料工房,"アズレンブルークレンジングバーム, 100ml",2100
2026-01-07,스킨케어_주간,16,ブラン,"マジックシカクリーム, 60ml",4790
2026-01-07,스킨케어_주간,17,Kopher,"キュリペアメラクリーム, 35ml",3190
2026-01-07,스킨케어_주간,18,アヌア,"ナイアシンアミド10%ダークスポットセラム, 30ml",2800
2026-01-07,스킨케어_주간,19,エイプリルスキン,"リアルカロテンIPMPブレミッシュセラムパックパッド, 80枚",2800
2026-01-07,스킨케어_주간,20,アヌア,"ドクダミポアコントロールクレンジングオイル, 200ml",2100
2026-01-07,스킨케어_주간,21,Redence,"トーン&スポットコレクターアンプル, 30ml",2565
2026-01-07,스킨케어_주간,22,SKIN1004,"センテラアンプル, 55ml",2375
2026-01-07,스킨케어_주간,23,COSRX,"RXザビタミンC23セラム2世代, 20g",2389
2026-01-07,스킨케어_주간,24,One-day's you,ダクトパッドセット,2550
2026-01-07,스킨케어_주간,25,KATAN,"シカダーマヒットセラム5, 30g",3740
2026-01-07,스킨케어_주간,26,Biodance,NEW X BEST 企画セット,3960
2026-01-07,스킨케어_주간,27,イズエンツリー,"超低分子ヒアルロン酸トナー, 300ml",2400
2026-01-07,스킨케어_주간,28,メディキューブ,"ゼロ毛穴パッド 2.0, 70枚",2400
2026-01-07,스킨케어_주간,29,ODELOI,"ブラックチェリー毛穴収縮クリームルフティグ, 100ml",2261
2026-01-07,스킨케어_주간,30,KATAN,"シカダーマヒットセラム10, 30g",5720
2026-01-07,스킨케어_주간,31,Kopher,"キュリペアSOSメルダーシステム, 1.5ml, 20本",5090
2026-01-07,스킨케어_주간,32,アヌア,"3セラミドパンテノールモイスチャーバリアクリーム, 100ml",2800
2026-01-07,스킨케어_주간,33,ドクタージー,"レッドブレミッシュクリアスージングクリーム, 70ml",1944
2026-01-07,스킨케어_주간,34,punbaki,"アデノシンピンクエッセンシャルトナー, 150ml",2950
2026-01-07,스킨케어_주간,35,アヌア,"ライスブライトニング酵素洗顔パウダー, 40g",1950
2026-01-07,스킨케어_주간,36,KISOCARE,"ハイドロクリームPHQ-8, 20g",1480
2026-01-07,스킨케어_주간,37,UIQ,"バイオームバリアパンテンシブクリーム, 50ml",2890
2026-01-07,스킨케어_주간,38,COSRX,"RXザ6ペプチドスキンブースターセラム, 150ml",2200
2026-01-07,스킨케어_주간,39,アテニア,"スキンクリアクレンズオイル - 無香, 175ml",1980
2026-01-07,스킨케어_주간,40,Yunth,"生VC美白美容液, 28個",3960
2026-01-07,스킨케어_주간,41,センテリアン24,マデカクリームシグネチャーエディション,4100
2026-01-07,스킨케어_주간,42,SKIN1004,"センテラクイックカーミングパッド, 70枚",3135
2026-01-07,스킨케어_주간,43,メディキューブ,"アゼライン酸ナイアシンアミドクリアトナー, 250ml",2300
2026-01-07,스킨케어_주간,44,CKD_GUARANTEED,"レチノコラーゲン低分子300毛穴弾力マスク, 5枚",2061
2026-01-07,스킨케어_주간,45,VTコスメティックス,"CICAレチノールポアアップセラム, 30ml",2767
2026-01-07,스킨케어_주간,46,セラディックス,131パッケージセット,3600
2026-01-07,스킨케어_주간,47,センテリアン24,パック尽くしセット,3470
2026-01-07,스킨케어_주간,48,AESTURA,"アトバリア365クリームミスト, 120ml",2500
2026-01-07,스킨케어_주간,49,セラディックス,"トリプルレチノールウォッシュピール, 30ml",3400
2026-01-07,스킨케어_주간,50,オーズナリー,"ビタ３セラム, 50ml",2850
2026-01-07,스킨케어_주간,51,manyo,"ピュアクレンジングオイル, 400ml",3500
2026-01-07,스킨케어_주간,52,irecipe,"シカPDRN跡クリアトナーパッド, 70枚",1407
2026-01-07,스킨케어_주간,53,ウェルダーマ,"ティーツリースージングハーブトックスピーリングパック, 150g",2160
2026-01-07,스킨케어_주간,54,スキンアンドラブ,"TXナイアシンエッセンストナー, 200ml",2590
2026-01-07,스킨케어_주간,55,ナンバーズイン,"5番 白玉グルタチオンＣ美容液, 30ml",2800
2026-01-07,스킨케어_주간,56,COSRX,"フルフィットプロポリスシナジートナー, 150ml",1690
2026-01-07,스킨케어_주간,57,ドクターオラクル,"EPLキュアセラムXD, 30ml",2154
2026-01-07,스킨케어_주간,58,Biodance,NEW X BEST 1+1 企画セット,6750
2026-01-07,스킨케어_주간,59,Sung Boon Editor,"シルクペプチドEGFハートフィットボリュームアンプル, 40ml",2850
2026-01-07,스킨케어_주간,60,スキンアンドラブ,"レチノールリペアセラム, 30ml",2690
2026-01-07,스킨케어_주간,61,バイオヒールボ,"プロバイオダーム3Dリフティングクリーム, 50ml, ",3356
2026-01-07,스킨케어_주간,62,manyo,"ピュアクレンジングオイル, 200ml",2200
2026-01-07,스킨케어_주간,63,メディキューブ,"コウジ酸ビタピールショット, 80ml",2400
2026-01-07,스킨케어_주간,64,ラゴム,"ジェルトゥウォータークレンザー [朝洗顔], 220ml",2310
2026-01-07,스킨케어_주간,65,アヌア,"PDRNヒアルロン酸100モイスチャライジングクリーム, 60ml",3200
2026-01-07,스킨케어_주간,66,celimax,"THEビタAレチナールショットタイトニングブースター, 15ml",2520
2026-01-07,스킨케어_주간,67,トリデン,"セルメイジングビタCアンプル, 30ml",1980
2026-01-07,스킨케어_주간,68,UIQ,"バイオームバリアクリームミスト, 50ml",4770
2026-01-07,스킨케어_주간,69,メディヒール,"ホワイトミルクブライトニングトナー, 300ml",2518
2026-01-07,스킨케어_주간,70,Sung Boon Editor,"グリーントマトNMNポアリフティングアンプル, 40ml",2750
2026-01-07,스킨케어_주간,71,AESTURA,"アトバリア365ローション, 150ml",3300
2026-01-07,스킨케어_주간,72,トリデン,"ダイブインセラム, 80ml",2950
2026-01-07,스킨케어_주간,73,KISOCARE,"バランシングクリームAZ20, 20g",1554
2026-01-07,스킨케어_주간,74,セラディックス,"ビタKダーククリア アイクリーム, 15ml",2300
2026-01-07,스킨케어_주간,75,Yunth,"マルチスクエアシートマスク, 120枚",2640
2026-01-07,스킨케어_주간,76,アイオペ,"PDRNカフェインショット, 30ml",4800
2026-01-07,스킨케어_주간,77,アイオペ,"レチノールレチジェクションセラム2%, 30ml",6018
2026-01-07,스킨케어_주간,78,ベントン,"ビタミンCセラム, 30ml",2690
2026-01-07,스킨케어_주간,79,トゥヴェール,"ナノエマルジョンディープ, 60ml",3610
2026-01-07,스킨케어_주간,80,ブラン,"マジックティーツリーオイル, 20ml, 2個",5020
2026-01-07,스킨케어_주간,81,ラゴム,"ジェルトゥウォータークレンザー [朝洗顔], 220ml, 2個",4400
2026-01-07,스킨케어_주간,82,ブラン,"9倍濃縮したドクダミ化粧水, 300ml, ",3200
2026-01-07,스킨케어_주간,83,ダルバ,"オールデイセラムメイクアップフィクサー, 80ml",3200
2026-01-07,스킨케어_주간,84,SKIN1004,"プロバイオシカインテンシブアンプル, 50ml",2945
2026-01-07,스킨케어_주간,85,SKIN1004,"センテラライトクレンジングオイル, 200ml",2470
2026-01-07,스킨케어_주간,86,celimax,"ノニアクネバブルクレンザー, 155ml",1584
2026-01-07,스킨케어_주간,87,センテリアン24,"エキスパートマデカクリームリニューPDRN, 50ml",2860
2026-01-07,스킨케어_주간,88,ミクスン,"大豆エッセンス, 30ml, ",2632
2026-01-07,스킨케어_주간,89,ダルバ,"ホワイトトリュフファーストスプレーセラム, 100ml",2700
2026-01-07,스킨케어_주간,90,De:maf,"マイファーストセラム, 155ml , ",2362
2026-01-07,스킨케어_주간,91,イニスフリー,"グリーンティーセラミドミルクエッセンストナー, 160ml",2373
2026-01-07,스킨케어_주간,92,manyo,"ガラクトミークリアスキントナー, 210ml",2400
2026-01-07,스킨케어_주간,93,メディキューブ,"アゼライン酸16BBカーミングセラム, 30ml",2800
2026-01-07,스킨케어_주간,94,アレンシア,ビタミンCもちプレミアムセラム,1241
2026-01-07,스킨케어_주간,95,ODELOI,"弱酸性毛穴収縮ニドソープ, 120g",1928
2026-01-07,스킨케어_주간,96,アヌア,"ドクダミセンテラレッドスポットクリーム, 30g",2200
2026-01-07,스킨케어_주간,97,COSRX,"RXザセラミドスキンバリアモイスチャライザー, 80ml",2450
2026-01-07,스킨케어_주간,98,SISTER ANN,"S-EGFエクソソームブーストショット美容液, 30ml",2970
2026-01-07,스킨케어_주간,99,メディキューブ,"ゼロ毛穴クレイパック, 100g",2120
2026-01-07,스킨케어_주간,100,VTコスメティックス,"PDRNリードルショットアイリフター, 15ml",2933
2026-01-07,베이스_주간,1,エイプリルスキン,"ヒーロークッション, 本品+レフィル",3600
2026-01-07,베이스_주간,2,オフラ,"ハイライター, ミニ",2541
2026-01-07,베이스_주간,3,ティルティル,マスクフィットルビーメッシュクッション,2821
2026-01-07,베이스_주간,4,ブラン,"皮脂ゼロエアフィットクッション, 本品",2980
2026-01-07,베이스_주간,5,ABOUT TONE,スキンレイヤーフィットファンデーション,2772
2026-01-07,베이스_주간,6,ABOUT TONE,"スキンレイヤーフィットファンデーション, 3ml",350
2026-01-07,베이스_주간,7,PERFECT DIARY,"トランスルーシェントブラーリングセッティンクパウダー, 3g",1870
2026-01-07,베이스_주간,8,ティルティル,"マスクフィットトーンアップエッセンス, 30ml",2673
2026-01-07,베이스_주간,9,ByUR,セラムフィットルースフェイスパウダー,1881
2026-01-07,베이스_주간,10,オフラ,"ハイライター, ミニ, 2個",4929
2026-01-07,베이스_주간,11,ルナ,コンシールブレンダーパレット,2350
2026-01-07,베이스_주간,12,ウェイクメイク,"シームレスウェアファンデーション, 30ml, スパチュラブラシ付き",3380
2026-01-07,베이스_주간,13,アイムミミ,アイムマルチスティックデュアル,1440
2026-01-07,베이스_주간,14,2ªN,ピュアグラッシュハイライター,1430
2026-01-07,베이스_주간,15,glow,"ブリーザブルBBクリーム, 30ml",3400
2026-01-07,베이스_주간,16,EITHER&,エッグスリックファンデーション+リップオイルセット,4300
2026-01-07,베이스_주간,17,ジョンセンムル,"エッセンシャルスキンヌーダークッション, 本品",3420
2026-01-07,베이스_주간,18,ブイディーエル,"トーンステインカラーコレクティングプライマー, 30ml",2980
2026-01-07,베이스_주간,19,TFIT,カバーアッププロコンシーラー,1467
2026-01-07,베이스_주간,20,ティルティル,"マスクフィットレッドクッション, 本品",2821
2026-01-07,베이스_주간,21,JUDYDOLL,メリハリマスターパレット,1986
2026-01-07,베이스_주간,22,Funny Elves,ソフトマットプレストパウダー,2199
2026-01-07,베이스_주간,23,D-RAY,"D-クリアファンデーション, 本品",1380
2026-01-07,베이스_주간,24,エイプリルスキン,"マジックスノークッション 3.0, 本品+レフィル",3600
2026-01-07,베이스_주간,25,ナンバーズイン,5番 白玉グルタチオンＣトーンアップベース,2500
2026-01-07,베이스_주간,26,スキンフード,サーモンダークサークルコンシーラークリーム,1100
2026-01-07,베이스_주간,27,ルナ,アーティストミキシングコンシーラー,2350
2026-01-07,베이스_주간,28,セルフュージョンC,"スキンブレミッシュバームインテンシブ, 30ml",2520
2026-01-07,베이스_주간,29,MAYBELLINE NEW YORK,"フィットミー リキッド ファンデーション R, 30ml",1700
2026-01-07,베이스_주간,30,トゥークールフォースクール,アートクラスバイロダンシェーディング,1738
2026-01-07,베이스_주간,31,hince,トゥルーディメンションラディアンスバーム,2580
2026-01-07,베이스_주간,32,ダルバ,"グロウフィットセラムカバークッション, 本品",2900
2026-01-07,베이스_주간,33,ラネージュ,"ネオクッションミューイ, 本品",3200
2026-01-07,베이스_주간,34,glow,ノットドライコンシーラー,3322
2026-01-07,베이스_주간,35,ウェイクメイク,"ウォーターグロウコーティングバーム, 本品+レフィル",2890
2026-01-07,베이스_주간,36,ブリーブリー,"オーラハニーグロウクッション, 本品＋レフィル",1190
2026-01-07,베이스_주간,37,ティルティル,"マスクフィットAIフィルタークッション, 本品",2821
2026-01-07,베이스_주간,38,TFIT,アイシーフィットカバークッションEX,2543
2026-01-07,베이스_주간,39,エスポア,ストロービングハイライター,2805
2026-01-07,베이스_주간,40,23yearsold,ダーマシンゼロセバムライスパウダー,1490
2026-01-07,베이스_주간,41,クリオ,"メッシュグロウエッセンシャルクッション, 本品+レフィル",3560
2026-01-07,베이스_주간,42,ティルティル,"マスクフィットオールカバークッション, 本品",2821
2026-01-07,베이스_주간,43,ティルティル,"マスクフィットクリスタルメッシュクッション, 本品",2821
2026-01-07,베이스_주간,44,YUNJAC,"スキンパーフェクティングプロテクティブベースプレップ, 25ml",3040
2026-01-07,베이스_주간,45,PERFECT DIARY,フローレスクッションファンデーション,2970
2026-01-07,베이스_주간,46,ABOUT TONE,スキンレイヤーカバーフィットコンシーラー,1254
2026-01-07,베이스_주간,47,ティルティル,"マスクフィットトーンアップクリーム, 50ml",2178
2026-01-07,베이스_주간,48,CHASIN’ RABBITS,"オールアバウトグロウカバークリーム, 35ml",2090
2026-01-07,베이스_주간,49,hince,"セカンドスキングロウクッション, 本品",2816
2026-01-07,베이스_주간,50,ByUR,セラムフィットスキニーグロウリキッドファンデーション,3069
2026-01-07,베이스_주간,51,フィー,"クッショングラスナチュラル, 本品",2860
2026-01-07,베이스_주간,52,ティルティル,マスクフィットオールカバーデュアルコンシーラー,1724
2026-01-07,베이스_주간,53,ブイディーエル,ローズPDRNプレップベース,3090
